评分,收藏,读过,简介,书名,题材,连载状态,最后更新日期,字数
10,108,1349,作死，跳楼，不再，真香！援气满满的皇女尤利娅无限作死中！现在记者采访一下我们可爱的皇女尤利娅殿下。“您第一次知道自己要作死是什么感想呢？”“其实嘛，一开始叫我去做，我是不会滴，我要去试一下，碰一下，哎呀嘛，史（死）真香。”“然后你就做了？”“是的”（露出哲学的微笑）,萝莉皇女今天也在作死中,魔幻,连载中,2019年5月2日,16211
6,42,1342,这是个发生在贞操逆转的世界，男主在这个世界的爱恨情仇。开局一只有趣的男性灵魂……（灵魂重生在了一个婴儿身上……是男孩呼！还好是个男孩（松口气。一男子充满慈爱的目光抱着男主，眼中寄托着希望，与期待！麻麻~这里有个变态叔叔想拐卖我~呜呜呜……喂我麻麻嘞？我不是才出生吗？我麻麻嘞？总感觉怪乎乎哒！我们故事也从这里开始……,我在逆转的世界为所欲为,玄幻,连载中,2020年3月20日,3750
10,30,1339,哈?问我身为第三性别的感受，没什么，就是要每天提防男色狼女色狼同学舍友之类的。对的，我为了保全自己的贞操而不择手段。我把你们当朋友，你们却想……重置了，哈,同寝室的到底是她是他还是k,都市,连载中,2020年3月25日,10177
10,38,1331,无知的将毒蛇纳入怀中，鲜花不如最低贱的苔藓，是顾影自怜哀叹无力可反击？还是仰望星空的疼痛将我毁灭？书友群:695958942,总有一天本猫要撕碎这滑稽的星空,游戏,连载中,2019年6月7日,28814
6,25,1327,剧情开始于美九篇，就如名字一样这本，带有一丝血色的同人文。,约会大作战之血色尘埃,魔幻,连载中,2020年11月23日,7549
10,50,1324,你以为这是一只狗？错！其实它是个穿越者。你以为他是一个废材？错！其实他是一个金手指还没开通的穿越者。这些都不是重点，重点是这些穿越者都要开后宫，但是我们的主角此时却变了一只萝莉……所以……你懂的,犬耳loli的日常,魔幻,连载中,2019年7月9日,22741
6,26,1318,qd，站短。,成为恶役大小姐真的不是我的意愿,魔幻,连载中,2020年4月12日,11309
6,38,1316,意外的降临，让他来到这个陌生的大陆被神变成了她。雷洛德大陆：一个以人族，神族妖族和魔族为主其它种族并存的世界，索菲娅睁开自己淡紫色的双眼,异界驱魔人之轮回之眼,魔幻,已完结,2019年4月18日,17752
10,41,1316,你是否懦弱，你是否勇敢。,天光变,魔幻,连载中,2020年5月17日,9280
6,14,1315,本来....那一天是那样的美好，可是却发生了一件可怕的是......就发生在我身上。我走在路上，突然！一辆货车向我飞快的行驶过来，我被吓完全动弹不得，接下来了，我失去了意识.......等我再次醒来......woc，什么鬼？我怎么是赤*的？等等.这不是重点，重点是....我??为什么长了一条尾巴？不，这也不是重点，重点是为什么我头上还有耳朵？还是猫耳？什么鬼，连我的声音都变了？,关于我变成机械娘的有些事,魔幻,连载中,2020年2月27日,8224
6,54,1307,在陌生的废墟中恢复意识时，幽州月的内心百味杂陈。  穿越小说她素有耳闻，但她没想到自己这种28k纯猫妖怪还能摊上这种稀罕事，穿越后居然连个身体都没有，所谓魂游天外的物理方式恐怕也不过如此了。    更糟心的是，视野下疑似村落的废墟中，四位幸存者正以不可思议的眼神盯着猫妖的方向，那如同发现新大陆般热切的视线让她感到头皮发麻。,当猫妖进入了约会大作战,魔幻,连载中,2020年12月9日,16539
10,119,1304,下楼倒垃圾，惫懒的懵懂猪头少年……在垃圾桶里捡到了失忆的美少女。女孩身上隐藏着什么沉重的秘密，带着阴云卷集，袭来，氛围渐渐焦灼。精神的不正常，分裂出两个截然不同的个体，而当这两个拥有几乎完全相同记忆的个体邂逅的时候……又会发生什么事情呢？我 捡 到 我 自 己,猪头少年不会捡到失忆症少女,校园,连载中,2018年11月1日,16705
10,71,1301,鸽子预警幼儿文笔预警,不正常世界正常日常,魔幻,连载中,2018年11月27日,33619
6,30,1300,让我们永远形影不离吧！,张雅的万界之旅,魔幻,连载中,2020年11月29日,4121
6,13,1298,原图不是我的,媚骨,玄幻,连载中,2020年3月8日,31598
6,36,1297,写一段时间试试水。,异之心,都市,连载中,2021年1月2日,3137
6,27,1293,日更月替 斗转星移从龙岛降临的龙子，必然会改变整个世界。无力的勇者 战栗的预言者找不到捷径的马车夫死在半路上的信鸽,Underworld,魔幻,连载中,2020年8月18日,25428
6,34,1287,一对一，女追男，玄幻种田都市。『作者高三党，不定期更新。语文功底不好，半夜更新可能内容会有些神志不清。』『ps:以后会重写部分内容的。』,我可没时间狐闹,都市,连载中,2020年11月4日,8974
9.8,121,1283,XX：“你，渴望力量吗？”亚汐伊：“……”XX：“你，想要复仇吗？”依旧是无人回应。XX额头拧成了井字形。XX：“你难道不想成为魔王对伤害过你的人进行报复吗？”亚希伊：“mdzz。”XX：“……”亚汐伊：“当魔王很累的吧？”XX：“麻烦你走吧……”,决定复仇的我才不要成为魔王,魔幻,连载中,2018年9月1日,18645
8,30,1283,Emmmm，这是一个披着百合、基情、性转皮肤的纯爱的王子公主物语（原本标题名想取《女装王子与男装公主》的，但是这里的标题名不准有“女装”所以临时改了），写着玩的东西，感觉有趣就写了，图个开心。内容准备走故事向，不是纯爽文，如果大家能喜欢就再好不过了。以及，我写文章基本是为了娱乐，但是自娱自乐就很无聊，所以如果大家不介意希望能多留言并发表对作品的看法，有个月票什么的就更好了，那么最后希望您看得愉快。,变装王子联姻记,魔幻,连载中,2019年9月24日,57024
10,27,1281,“做我夫人吧，水寒。”     “不要，滚。”     “做我老婆吧，水寒小姐？”     “西内！”     “成为我的.....”     这些家伙一天一个告白烦不烦人？我只想当一个普普通通的小中医啊！     “这位姑娘，请给我把把脉吧。”     呼，还好，来了个正常人。     “诶呀，姑娘你把我捏好了！本人必定以身相许！”    “.....”自嗨，勿喷,完美丈夫穿越妻,都市,连载中,2019年7月12日,4292
6,35,1278,这书又名关于我摔了一跤到斗Ⅱ的故事，这书只是作者的一时脑洞，写不了多少，也不用打赏（虽然也不会没有人打赏），但是点赞还是想要的（反正又不要钱），佛系更新，大家看看就好，不喜误入,听说我叫唐雅,校园,连载中,2020年3月30日,9180
6,25,1277,我叫王俊，今年24快30了，哎呀老了老了～读者：“作者！更新啊！”“更新屁，老子没时间！”王俊表示满不在乎。读者：“作者可能猝死了，上香”“？”王俊看到这个评论，内心毫无波动，不屑一顾。就在下一秒，躺床上如咸鱼的王俊忽然眼前场景一黑，感觉眼睛看东西越来越模糊。“咋回事？！”王俊忽然惊慌失措。眼前一黑，仿佛掉入了无尽深渊。,报复鸽子作者,魔幻,连载中,2021年1月3日,19699
6,38,1275,一代冷血女杀手，重生到了一个落魄小公主身上，刚穿越就收了一只可爱的小精灵？只是开个玩笑就多了一个时时刻刻盯着她的大姐姐？什么鬼，只不过长得很可爱而已，就可以征服世界？为了征服世界，雾姬说，节操是什么？我怎么不知道有这个东西？呵呵，脸这种东西我早就不要了。本文属于搞笑，大脑洞，异世界，百合女主属于荷尔蒙体质，不但吸引男人，也总是会有一堆女人围过来,原来可以用卖萌来征服世界,玄幻,连载中,2019年6月8日,25714
9.7,23,1267,这是彩虹六号的上瘾之作~主角为娘化的buck不按照严谨的游戏来写。,彩虹的彼端是咚咚咚,科幻,连载中,2018年3月26日,9339
6,24,1265,女主穿越到古代……（是个古风的哦！）,娜丽丝穿越记,古风,连载中,2020年5月31日,2940
9.9,86,1262,我不是自恋。我是自恋。我不是伪娘。我只是长得好看而已。,才不是自恋狂咧,校园,连载中,2018年8月31日,20916
6,40,1259,穿越成为异世界的我，莫名变成了女生，他（她）该何去何从,重生到异世界的我却转性了,玄幻,连载中,2020年4月26日,8195
5.5,43,1258,穿越者都是龙傲天，自带金手指？不，本书详情说出了穿越者来到了异世界后的悲惨生活。而且，还变成了女孩！（滑稽护体）也有可能是金手指发错货了呢？,穿越者我可能是最惨的,古风,连载中,2020年3月6日,4131
5.5,10,1251,加油,九十天减肥一百二十斤,校园,连载中,2020年2月18日,3156
6,30,1246,东方东极青华大帝太乙救苦天尊的座下大弟子杨凡渡劫失败后居然没有死，而是重回少年时代！,重生之无悔,玄幻,连载中,2020年11月18日,9026
6,32,1245,辽宁，我会找到一切的幕后主使的，现在，我要去完成你交给我的任务了……本书为辽宁的续作，在辽宁整改的时候可以看一看,为守护辽宁而回到现世,科幻,连载中,2020年3月18日,1517
9,62,1242,穿越到异世界的我以一个女孩的身份活了十六年，本以为一切都将解脱时，却发生了意想不到的展开？,死亡骑士与异世界,魔幻,连载中,2017年12月17日,17915
6,43,1240,很普通的他经莫名其妙的传召到修仙界，却成为了一个丑女，母亲在生她时难产而死，尽管下人从不对她一个庶出之女有眼色，父亲和娘也从不对她有什么要求，漂亮聪慧又温柔的妹妹也对她关爱有加，可她虽拖着不能修炼的废柴之身却也想着变强大不白来一遭。不签约，随缘更，等什么时候不想看小说就更。本书第三章，有自看变嫁以来看过的精品小说,丑女修仙记,古风,连载中,2020年11月16日,9556
6,57,1237,简介无力，请看正文,是他逼我嫁给他的,都市,连载中,2020年10月8日,592
6,40,1235,哥哥以后我们的命运会怎么样？当然是各走各的路啊，我愚蠢的妹妹。暴打。,兄妹的轨道线,校园,连载中,2020年6月16日,9537
9.5,51,1233,她的名字叫做棠莉莉，是一名备受欺辱的小女孩儿。   在黑暗的生活中，她追逐着一个不可思议的梦想。  直到...她碰到了一名不可思议的独角兽，她的人生被彻彻底底的改变了。    （不谐之元魔女传：百合文）  关于更新的口号:给我一点时间，还你一片蓝天??  电脑持续损坏中，距离修好还有1周。  9月4号  ,不谐之元魔女传,魔幻,连载中,2017年8月14日,87656
6,26,1233,艾斯德斯：我的梦想是成为大鸽一样的大鸽。,咱要成为大鸽,同人,已完结,2020年1月22日,2144
6,27,1232,前世的她是一个杀人无数的罪犯，神明看着她的样子有些不忍，便将她送到了另一个世界生活。,获得虚拟之力的我变成了女孩子,魔幻,连载中,2020年2月27日,8488
9.2,5,1231,校园里总是有这样那样的爱情故事，哭过，笑过，但总有一个人让你日日夜夜想着。难道不是吗,悄悄喜欢你,校园,连载中,2018年12月16日,13737
10,79,1229,一场意外，柳卿变成了一个女人…躲起来的她被他找到，从此…变成了一个废物。.....其实原本想用原来的介绍的，但是剧情会改变很多，所以就不准备继续沿用原来的了。ps-如果你觉得这本书好像在哪儿看过，不要疑惑，也不要问，你肯定是看过的。也不要来说什么我抄袭啥的，我就是写那本书的！算下来有七万初稿，大家可以放心入坑.,只会打游戏那还真是抱歉,游戏,连载中,2020年2月17日,6929
10,62,1225,雪，有些冷，但是...我的心更冷...夜，有些凉，但是...我为你带来那一丝温暖...,永远爱着你,都市,连载中,2019年10月9日,7576
6,21,1222,在剑与魔法的时代，阿尔玛.迟，决定用科学改变这个世界~,来到异界的我决定开启工业革命,魔幻,连载中,2020年7月2日,17765
9.9,43,1221,作为一个穿越者，你的首要工作是什么？洛尘:优先查看自己所处的环境，以及自己体内是否有某种神秘力量，然后随手救下一个妹子，把她发展成自己的老婆……一个月后，什么都没发生，洛尘:逗我呢？那我来干啥？算了，不用为了拯救世界努力卖命也挺不错的。一次召唤过后……一只萝莉站在阵法中心……,身为改造英灵的使徒的我的老婆,魔幻,连载中,2018年8月7日,49929
10,79,1219,我们从未知晓1999到底发生了什么，但那一切的不思议都在2019的夏天出现。神秘而不可描述的1999，向平凡充实的2019来袭。做着白日梦的苏夏祺，等待着他的却是一次意外死亡，然后他变成了梦中女孩的模样。在神明、恶魔、妖怪的交错舞台下，不可知的亵渎在苏夏祺所在的小镇如影随形，准备侵蚀现世。慢热魔幻风。其实本质上是个集卡小说。,自旧日乐园1999,玄幻,连载中,2019年1月15日,33182
6,63,1212,死亡――一个老套的开始。平行的世界里，他变成了她，他成为了她。但是改变的就真的只有性别吗？不――改变的不只是这些。（介绍无力，我果然不太擅长介绍。）,雨停了之后,校园,连载中,2019年5月2日,10263
6,14,1202,再寒冷的冬天也比不过人心的黑暗，如果这个世界真的已经没有救赎了的话，那就让凛冬降临吧。,霜凛乌托邦,魔幻,连载中,2020年8月4日,17866
6,9,1199,传说呢，当年王昭君入宫，没有给那画师毛延寿送礼，毛延寿心中不喜，便故意将她画的奇丑无比，让她失去了成为皇妃的可能，但是，历史真相真的是这样吗？出塞的，真的是王昭君吗？也许，我们都忽略了什么呢……（各位看官要是觉得简介无力，可以直接看正文，因为看完正文后，你会觉得简介其实挺好的～）,昭君不出塞,古风,已完结,2020年10月2日,3209
6,24,1195,朝六晚九上班族的秦海明，不堪疲惫晕到在了回家的路上――醒来后却发现自己变成了另一个小女孩??!自己的原先的身体已经猝死了??!!还有临死前收到奇怪的短信：“人生重组开启”???“笑!让你笑啊啊啊!!”对此毫无办法的秦海明，只有揪住幸灾乐祸的义弟衣领疯狂摇晃,Change重组人生,都市,连载中,2020年6月20日,8434
6,29,1188,萧沐青，一个普通的高中生，母胎单身的他，在夜晚总有一个不可告人的秘密，从前的时候没觉得恋爱是重要的事情，可随着青春期的进入，他越来越渴望恋爱的感觉，就在愿望最浓厚的时候，他以前的一直不变的梦从模糊开始变得清晰，一场恋爱的梦，在那一刻开始。“少女，开始我们的恋爱吧！”某不知名的黑色身影。（就当sd小说看吧，第一次写言情，大失败！）,变成古代女性谈恋爱居然在梦里,古风,连载中,2020年8月31日,19686
6,15,1184,烈日炎炎，黄沙漫漫；背井离乡的她为了完成她那自诩为“天使”的使命，只身来到了这样一个不毛之地，螳臂挡车般的与“伊拉克和大叙利亚伊斯兰国”展开了一场你死我亡的巅峰对决。PS：本书乃作者闲来无聊没事找事之产物，可能需要看作者心情更新；（手动滑稽保命）,糖娘的沙漠战场,魔幻,连载中,2020年7月21日,6296
10,50,1176,总之，这是一个关于带着小孩在异世界（努力？）生存下去的故事??,带着孩子也能在异世界生存,玄幻,连载中,2019年7月18日,9334
6,14,1170,欢迎来到木兆酒屋，有什么不开心的事吗？那不妨来喝一杯吧！,木兆酒屋,都市,连载中,2020年3月28日,14037
10,20,1170,人家的穿越都有各种各样的秀法。就我是坐飞机降落到异世界的吗？吐槽会挂在头顶也就算了，还开启了对男♂用外挂……神明是纸片人，神使是辣眼睛的金刚芭比。我，也许是穿越成功人士里，混得最惨的一个。然而更惨的，还在后面呢(????ω`?? )而且作者丧天良，是个断更老贼。想看爽文？怕是没可能了。,嫁给我的公主是比我还要大的男生,魔幻,连载中,2020年3月7日,14375
6,28,1168,太阳从西边升起。“嗯?”是的，东边降落。“哦!”太阳从东边升起!“胡说，明明是西边升起!”我指着月亮说，那是太阳!你会相信，因为你只能这样，来获得印同。要知道从群体获得的更加容易，只要做到服从。你无法看见自己，你也无法看见自己。你看见的只是自己!是谁让你如此的。如此的成为受体。是你自己。是我。然而你又是那么的虐性十足。你会不相信。你会爆发出岩浆般的黑暗血色，侵染所愿。,日暮流光,玄幻,连载中,2020年10月16日,11914
6,18,1165,悲惨的少女来到异世，能否获得幸福？注：此文为本人练笔作，欢迎建议与批评但不欢迎人身攻击。（封面来源于网络，如有侵权，通知必删并道歉。）,在约战中与美好相遇,魔幻,连载中,2020年11月22日,8
6,31,1161,上村树本是一名普普通通的青年，父亲赌博，母亲离家出走，虽然考上了理想的大学，却处处被人排挤，被迫退学，成为了一名小职员，每个月领着仅仅够自己基本生活的工资，而这一切，却因为一件事而改变……,精密动作无限,都市,连载中,2021年1月7日,16934
6,15,1160,一天过去了，教室里面的荷岚背着书包回家，在那一瞬间荷岚看呆了，一个长发女生在马路上，一辆公交车突然向右边的公路上撞去。在电光火石之间他飞快的奔向女生，之可惜为时已晚两人的尸体被碾在冰冷的车轮之下。       “我是谁我在哪？”       “傻妞，你以后就是我学生了，别问为啥”       “？？？”,平凡的我被异次元大法师盯上了,玄幻,已完结,2020年8月18日,6065
6,15,1159,为什么别人穿越都是龙傲天凤傲天，我穿越就成了废材，我真的不是点了地狱难度吗？,我怀疑自己是不是点了地狱难度,魔幻,连载中,2020年5月21日,3035
6,35,1149,"第一道天雷：愚蠢的蝼蚁正在走向毁灭第五道天雷：不自量力的凡人妄图挑战天道第二十道天雷：卑鄙无耻的投机者仍心存侥幸第四十道天雷：渡劫之人似乎扛过了半数天劫第六十道天雷：渡劫期大能的实力令天道也感到畏惧第八十道天雷：至高无上的救世主即将得道升仙以接管他忠实的修真界天道：你不要过来啊！我要读档！",关底boss转世后唯恐天下不乱,玄幻,连载中,2020年12月12日,8627
6,23,1145,从黑暗中探出感知的触手,我成为了魔法蛆虫,魔幻,连载中,2020年10月31日,69
6,46,1144,我一直梦想着成为英雄，虽然我没有那个能力，但是我却依旧站在了英雄的身边。“是啊” 艾伦一把抓住安洁莉娅的手，“我可爱的老婆大人，我这个英雄称不称职呢？”作品一周一到三更，作者很忙的，不要催了。,我想在你的身边守护你,魔幻,连载中,2020年7月19日,8945
6,34,1144,当夏红染再次从冬眠中醒来之时，整个世界都不在一样了，大地之上已成为了一片废土，曾经的家园已然不见，而废弃的战争武器则主宰了这个破败不堪的世界上，但是更为重要的是她一觉醒来之后，自己就已经不再是自己了，而和自己一起冬眠的妹妹也再也不见踪影了。,末日后的新生活,科幻,连载中,2020年3月20日,18551
9.3,73,1143,苏云汐:穿越到平行世界的我……谜之音:变成了萝莉!苏云汐:遇到了曾经的自己――现在的哥哥兼男主。谜之音:但他父母双亡，有妹有房!而且便签没打“自嫁”谢谢。苏云汐:但是哥哥很喜欢像我酱紫的小萝莉。谜之音:萝莉?不存在的，早晚变成少女。苏云汐:……你过来，我保准不把你喂虫!,暗生鬼降,魔幻,连载中,2018年10月10日,19090
6,57,1142,被炒鱿鱼、相亲被拒、炒股崩盘。已经完全崩溃的他选择了放弃自己这已经没有任何救赎可言的人生，选择新的开始。――来世，我想成为有钱人，不愁吃喝住穿，受万民敬仰，而且还能谈一场完美的恋爱。可是为什么会变成女孩子！还被选为圣女了啊！虽然有这样的疑惑，但是当她抓到魔王的那一刻，她突然觉得自己的人生巅峰到了。“嘿，嘿嘿嘿......把魔王{教成自己的宠物什么的，好像很不错啊......”,转生圣女要{教魔王大人,魔幻,连载中,2019年8月20日,5439
6,16,1141,薄荷，一种神奇的植物，墨小熙喜欢薄荷，也喜欢薄荷糖，她喜欢薄荷糖给自己带来的清凉和微甜，但是，糖罐总会有空的一天，喂！木头，罐子空了，你要不要去给我买薄荷糖？,墨小姐的薄荷糖,校园,连载中,2020年12月26日,9134
6,19,1132,我要说我的灵感来自于一本本子，你们信吗？,我家夫人会时停,魔幻,连载中,2020年5月28日,1078
6,18,1130,王利通过一个偶然的机会，穿越到飞车世界并成为了小橘子的脑洞故事。,变成小橘子的我也很绝望,游戏,连载中,2020年4月4日,3105
6,13,1125,少女们的秘密花园,秘密花园,都市,已完结,2020年10月2日,5882
6,45,1123,某个生活在21世纪的少年李杰，因为下雨天玩手机导致被雷劈死，而意外重生到异世界变成了女主角。我叫沈干奇，我先说明:我不是主角，只是一个扑街作者，因为突然想写一部玄幻小说，小说名叫《高冷与呆萌》，但是我却穿越到我的小说里了，并成为了一个原小说里并没有的女角色，那我就可以看见原本主角人生经过。,重生在异世界的路人女主角,玄幻,连载中,2020年12月13日,7633
6,25,1117,"灵气复苏，修炼时代。一只猫娘与某憨憨男主的修真日常。李耀：“刚刚谁在叫我？”（网图,侵删）",天上掉下个猫娘,校园,连载中,2020年8月17日,8018
6,35,1117,最浪人和帝国公主的冒险生活,公主什么的最麻烦了,魔幻,连载中,2019年8月17日,56918
6,32,1113,。。。。。。。,重生猫耳娘,玄幻,连载中,2020年3月31日,1513
8.7,24,1109,我们的征途，是星辰大海！,星河战机,科幻,连载中,2018年10月28日,11381
10,49,1106,远古时期，中土大陆生出一只吞噬日夜精华的强大恶魔，落入凡间，厮杀抢夺，直至仙帝・叶怀仙（从某人那拿到的名字，滑稽）出手封印，凡间才得以安宁。      奈何恶魔擅蛊人心，但凡路过之人，他先以愿望诱之，使其满意，随后签下契约，让许愿者生生世世照顾恶魔，然后作恶魔的好妻子，生下许家人的后代。     王维娜：诶！！这是你们家祖传的秘密吗？     许启明：不是，那是我编出来骗小孩的。     王维娜：……,许愿短篇试水,魔幻,已完结,2019年7月27日,26226
9.8,191,1102,"周室衰微,王纲不振，诸侯强并弱,齐楚秦晋始大,政由方伯.",夜如何其,都市,连载中,2017年12月2日,24002
6,18,1100,平凡的我，来到这个世界。 并不是我想成为魔女。,我们还能再见吗,古风,连载中,2020年8月26日,7682
6,37,1095,十一年前的雨夜，举世瞩目的唯一贤者之石遗失在了王都之外，暴乱因此而生，而就在风暴即将来临之际，在没有任何人注意到的阴影里，一辆马车带着一对母子，悄悄离开了王都，驶向了无人可知的未来。十一年后，少年拖着巨大的行李箱和少女坐着轮船回到了王都。,贤者之石与女仆小姐,魔幻,连载中,2019年3月21日,58053
6,25,1091,挖坑“一个人挑起的战争，就应该让一个人背负一切”――本该是这样的。“喂，穆薇，在发什么呆啊？jo级生物也会有无意义的思考吗？”“闭嘴你这大钢块直男！我这在怀旧呢！情怀懂不懂！？”“亲，我的身体只有77.1%是机械哦。还有老婆，今夜行动目标是谁？”“嘿，当然是我们的小川*了。走走，let‘s go！”别名：《真??钢铁直男和真??肉麻少女的爱情故事》注：本书中一切观点纯属娱乐，请勿当真。,人类进化歪论,科幻,连载中,2020年5月28日,27710
6,19,1088,本书为泰拉瑞亚同人，作者是第一次写书，有什么不好的问题就提出来，本书为第一人称视角，封面为Boss版本的主角，嫁人会在回到原本世界时再写（随缘更新）,在泰拉中美好的回亿,游戏,连载中,2020年11月30日,3568
6,11,1087,[介]        在西元2239年10月28日美科W家成功研究出可以接收2M位以上的指令的超X-星。        但就在淦拥乃查gXa生了自我意RK快速入侵、掌控了世界上所有的智能科技，其中包含自l射器，然後θ世界的人l射。        在那之後存的人了生存，而躲在一百年前的先人所留下的地下用基地中，K企D反??,造物的逆u,科幻,连载中,2020年8月16日,20064
