评分,收藏,读过,简介,书名,题材,连载状态,最后更新日期,字数
9.1,62115,2077.5,穿越到玄幻版的战国东瀛，百鬼夜行，战乱不断。本以为我也能进入玄幻的领域，却没想到自己没有任何修炼天赋，武士、忍者、僧人、阴阳师一个也当不了。好不容易穿越一次，人生没追求和咸鱼还有什么区别？哪怕是堕入妖道，甚至变成女孩又怎么样？我依然要逆天修行，我必为妖帝！胆敢奴役我，把我当做式神的这个混蛋，我必把他…正宗:小灯你要把我怎么样啊？灯莹:哇！主人！什么都没有说！,百物语之主,魔幻,连载中,2021年1月5日,4934492
9.7,60762,1676.6,少年在连续逃过两次车祸后，最终还是不幸败在了香蕉皮上。在感觉命不久矣时，少年心想：“如果能穿越，请给我一场美好的恋爱。再不济有场约会也行。”………“请和我约会吧!”五河士道真诚地请求道。两仪梦月(♀)掀桌怒吼道：“尼玛这不是我想要的约会口牙!!!!!!”,这不是我想要的约会,魔幻,连载中,2021年1月8日,2041101
8.6,59641,1310.7,为什么刚醒来我就在生孩子？为什么我生下来的是两颗蛋？什么我是凤凰？就那个被吃了可以长寿的凤凰？等会我不要被吃掉呀！！还有孩子的爹是谁啊？！“老婆……那个……”“滚！离我远点！”（一脚把某个臭男人从床上踹下去）读者群：485310655（新群旧群已炸）,重生为凤凰的我正在带孩子,魔幻,连载中,2021年1月14日,1385402
9.4,53270,1224.4,来自异世界的灵魂来到了他的体内。他学会了魔法，拥有了异世界三百年的记忆。可是身体似乎渐渐的女性化......不是！我才不要被魔法变成女孩子！新书《被萌鬼上身的我却成了女孩》,我才不要被魔法变成女孩子,都市,已完结,2020年9月14日,1407469
9.5,35154,964.5,他只是一个普通的高中生，却莫名其妙地和一只母猫发生了量子纠缠，每次观察都会发生一次坍缩，但唯一的观察对象只有一个，就是他自己的意识，因此他必须时刻保持清醒，不然就有可能变成一只猫。不过……为什么舍友兼发小的秦毅，这个堂堂男子汉是个沉迷于撸猫的混蛋？直到有一天……他从一只母猫升级成了猫娘……本文单纯的高中校园生活，不喜勿入哦,我变成了舍友的猫咪,校园,连载中,2021年1月14日,576255
8.2,35106,856.1,新书都市变嫁《只有卖萌才能苟活的我就是屑》感兴趣的读者可以一看――――为了恢复患有隐疾的身体夏家备受宠爱的小少爷夏涓决定破茧重生，然后……变成女人！想娶我？先打败我再说！男子汉大丈夫，我夏涓就是死了，死外边儿，从这里跳下去，也绝不嫁人！这是一个钢铁直男被迫变成贤妻良母，一个自卑而自负，三观不正的少女沐浴在阳光下后变得美好的故事慢热文求月票！QQ群:816177704,第一公子的我变成了女人,古风,连载中,2021年1月15日,2774054
8.4,39254,825.8,法兰克帝国殿堂，国王坐在台上笑而不语。艾莉娜：“主角，你看那个女主长的多漂亮，那可是稀有的夜精灵一族啊，赶紧跟她原地结婚吧！”主角：“我不。”艾莉娜：“主角你什么意思啊？女主肤白，貌美，胸大，屁股翘，怎么就配不上你了啊喵～”主角：“可是我喜欢的是....”国王：“决定了吗？”主角：“嗯，国王，请将您的女儿嫁给我！”国王：“好！”艾莉娜：“喵喵喵？！”（新文求支持～质量保证～）,反派公主的我才不要被主角给攻略,魔幻,已完结,2020年12月28日,1173055
9.1,40227,808.9,穿越架空武侠，看少女如何称霸武林，最终……嫁人,变成少女的我要称霸江湖,古风,连载中,2021年1月11日,2954826
8.4,38136,798.4,（本人新书：1、《我可以进入少女们的噩梦》，脑洞、后宫、迪化）（2、《参见女王大人》，嫁人、纯爱、校园）都说冷月魔女是最强反派boss！亦正亦邪的女魔头！游戏世界人气最高NPC！仙侠正派的噩梦！林南淡定的表示，那只不过是他的一个小号罢了。书友群（1）1022981118 书友群（2）279493551,都以为我是反派NPC大佬,游戏,已完结,2020年9月30日,1750009
9.2,40791,758.7,群：642503608       （剧透，结局完美）灵异复苏，恐怖怪异侵蚀现实，且看重生为美少女的主角如何在馋她身子的诡谲怪异和凶灵厉鬼的魔爪下保住小命，逃出生天！       “就这？给??爪巴！”少女抱着骨灰盒，口吐芬芳。        ps：日常+副本逃生+恋爱(??°з°)-??，女主小嘴很甜，剧情前面有点慢热，之后全程高能，有一点点吓人，觉得害怕可以躲被窝里看哦~绝不写崩！,从恶灵开始的非日常生活,校园,连载中,2021年1月14日,1653528
9.5,36438,734.3,重生过去，变成萌妹。遇到自己，正十七岁。想玩养成，不幸白给。如此操作一气呵成，是重生者里的豪杰。        ――       纯日常，慢节奏。       如有不妥，及时认错，死不悔改。            书友群814983725,重生后的自我攻略日常,都市,连载中,2021年1月3日,1224152
9.1,34111,700.4,我，是一个废人，没有天赋，没有毅力。品德败坏，懒惰无比。终于，我犯下了不可饶恕的罪行。留给我的还有一个出路。获得神的恩赐，成为神的使者，转生成为一个天使，为太阳之息教会战斗。看来，我还有努力的机会，等等，你说教会的转生天使都是女的！不要啊，我有没有其他的路可以选择啊！这是一个背景黑暗，剧情却很欢乐的故事。书友群：773513070 欢迎各位书友,天使是如何练成的呢,魔幻,已完结,2019年3月12日,2626897
9.3,39049,696.8,因为断更被读者打死的我，转生成萝莉冰龙王。拥有着外挂般的实力，终于过上了不用努力，就可以混吃等死的生活。然而愉快的时光，因为闯来的剑圣而结束了，可疑剑圣把我踹翻，还诓骗我带上了奇怪的项圈。“等等等，你给我戴的是什么玩意？”“……玩具。”“果然你就是个鬼畜的萝莉控吧！”,废宅龙王的我被可疑剑圣拐走了,魔幻,已完结,2020年5月27日,1440572
9.5,39265,694.6,舒宇墨是一个阳光正直乐观开朗的三好学生。直到他膝盖……呸，直到他某一天在医院里被检查出了绝症。然而在“缘”这个词的帮助下，他捡回了一条命。舒雨歆仍然是一个阳光正直乐观开朗的三好学生，可能唯一与之前有点小小的不同的，就是她的性别了。就在这么一个前提之下，我们的女主小姐以她全新的身份，开始了一段全新的生活。简单点说，就是一个普通女孩的普通大学日常。,变成妹子后的大学日常,校园,已完结,2020年10月20日,1036638
9.1,33711,634.9,在一个平常无比的现代世界。普普通通的少年――绘路，过着他自由自在的日常生活。两年前的某一天，一切都变了。我怎么变成了一只萝莉？角？翅膀？尾巴？什么鬼啊！等等，这不是游戏里的角色么？又好像有点不一样……一名普通少年就这样，变成了一枚和游戏角色高度相似的萝莉。这是一只萝莉魔王隐瞒身份，在现代都市中的日常故事。书友群:1016595165,反正朕只是个爱摸鱼的魔王,都市,连载中,2021年1月15日,685396
9.1,27820,614.1,重生来到斗罗大陆的世界，没成为人类变成了魂兽怎么办？一个少年来到了斗罗大陆2世界到底会刮起怎样的旋风呢。ps:变身嫁人，不喜勿进，取向说清楚了再进来搞事我就骂人了！,斗罗大陆之麒麟,玄幻,连载中,2021年1月13日,566953
9.2,32677,598.2,穿越异世大陆后我果然如其他主角一般顺利得到了顶级天阶传承。  “等等，九尾传承女孩子才能继承？是不是搞错了，我一男的。”          “什么？继承了就会变女孩子？！不继承就成太监？     哦，那没事了，九尾传承怎么继承来着。”  本书慢热，原创体系。  群：797903004,本狐仙才不要祸乱天下,玄幻,已完结,2020年12月20日,1584032
9.2,27881,597.8,新书《猛男的我意外变成了美少女官差》，《第一公子的我变成了女人》感兴趣的可以一看。一个江湖大佬变成女人的故事。简介简单，故事不简单。武侠框架，玄幻设定，嫁人，一对一。这就样。,江湖大佬变佳人,古风,已完结,2020年11月17日,1324429
9,30527,557.2,仙侠世界的最强者，玖月，在渡过了天劫之后并没有选择飞升，而是借这样的机会试图回到地球。他成功了，但原有的身体也因为空间乱流毁坏掉了，不得不重塑自己的身体。于是，在他自创法术“三千化身”的作用下，他变成了一只九尾天狐而且..是一只母狐狸（沙雕欢乐向，轻松有虐，不喜勿看）群号:850594863 和另一本书一起,无敌的我回到地球却转生成了狐娘,校园,连载中,2021年1月13日,1367508
8.7,26915,540.6,我叫千绫梦是一个精灵，我现在很慌，因为眼前这个叫五河士道的少年对我发出了约会邀请。要是在以前如果有人想要和我约会的话，我应该高兴才对，可是我现在一点都高兴不起来……士道:“绫梦你可以和我约会吗？我一定会拯救你的！”看着少年坚定的眼神，我实在是不忍心拒绝他，于是我便用着委婉的语气回道。“滚！虽然我现在是女的，但是老子的内心还是男的！你要搞基找神无月去！”士道:“……”本书嫁人，不喜勿喷,在约战变成精灵的我拒绝约会,都市,连载中,2021年1月13日,462886
8.6,23416,492.9,卡列尼娜(坐在桌前，神情严肃):无需多言，这一次的研发经费你到底批不批。赫格尔(面露难色):容我考虑一下...卡列尼娜(小脸羞红):...今晚我穿女仆装。赫格尔(双手一拍):成交！卡列尼娜(满脸羞愤):死变态...(一对一),身为王女的我绝对不可能被攻略,魔幻,连载中,2020年6月20日,903064
9.4,27437,490.3,原本是一名宅男的林拊剑在自己意外死亡后穿越到了一名脑瘫痪的女孩身上。为了治好女孩，女孩的父母发明了虚拟游戏，并将女孩的意识放入游戏中。然而，他却发现真正的主角似乎不是他。“为什么我都变身了，主角依然不是我？”ps：书友群：81570812。,变身在网游,游戏,连载中,2020年12月12日,1695492
9.3,14333,485.9,少女在黑暗中醒来，一段记忆慢慢的拥入脑海，这是一个女孩从小到大的记忆，但这个女孩不是自己吗？但我又是怎么回事？  终于……少女发现自己居然是这个女孩的里人格！  但是里人格怎么了？里人格也是一个人啊！  里人格开始努力的证明自己，自己是真正存在的！  读者群961015670 来看作者花式加更,我只是一个里人格,魔幻,连载中,2021年1月15日,551206
7.9,25315,462.5,"新书《全世界都在觊觎转生精灵公主的我》“木璇小姐，看在木老爷子的面上，奉劝你几句话，三十年河东,三十年河西，莫欺少年穷!”铮铮冷语，让木璇笑的合不拢嘴。“三十年河东，三十年河西，莫欺中年穷!”“三十年河东，三十年河西，莫欺老年穷!”“算了，木璇仙子，死者为大，您就高抬贵手让他们入土为安吧。”",变身仙子的我绝不做恶毒女配,古风,连载中,2021年1月15日,1303129
9.4,27267,458.3,“我，白夏，系统亲女儿，今天就是要打死你然后接收你的财产！”白夏晃了晃手中反射着寒光的匕首，面无表情的看着对面的男人。男人沉默了半晌，然后……抱起她丢到了床上，并有条不紊的掏出了自己的武器。“等等！你做什么？！”“打架。”白夏：“……？？？”PS：“真男人是有两把剑的。”“滚啊！”（奇奇怪怪读者群：594100992，欢迎来玩。）,网瘾少女不会恋爱,游戏,连载中,2020年11月5日,1047697
9.4,25139,456.7,沉迷女色的魔王基玛，死于勇者剑下，变身魅魔， 放下魔王尊严，委身于无知的勇者，妄图打入敌营，撬走勇者的女人....乖巧听话的魅魔，在勇者转身的一瞬间，狠狠盯着对方的背影，心中暗道：“力量会有的，后宫能重建的，仇会报的。”PS:变嫁+成为男主正宫。,魔王大人即使变身也要复仇哟,魔幻,连载中,2021年1月15日,1710648
8.8,25447,455.6,小樱：鸣子！鸣子！你不觉得佐助很帅吗！鸣子：是吗？小樱：你看他还很厉害，班里其他男生都不是他对手！鸣子：是吗？.... 佐助：鸣子，今天一定要赢你！鸣子：别吧？你又想输了穿女装了？,我鸣子才不要当火影,魔幻,连载中,2021年1月9日,1158999
9.4,22823,381.2,一觉醒来到了末世，变成了充电器体格，只要通过体液接触，就可以给那些异能者充电。  主要是为毛变成妹子了啊？  喂，作者，你故意的吧？  ？？？  （ps：新手上路，请多关照0.0）   (p2：本书主角不是rbq!不是rbq!不是rbq!……重要事情说三遍，偏向纯爱)    (p3：qq主群：945412289，剧情日常尬聊，qq2群：958366955，无底线斗图。),末世里的充电器实在是太恶心了,科幻,连载中,2020年10月4日,753755
9.7,28856,365.8,刺客重生化身全能的毒舌女仆，遭遇赌命流男主死缠烂打？人生重开下的两位男女主角在命运的安排下相逢，他们会碰撞出来什么样的火花？--男主欲哭无泪地看着抵在心口的银色匕首：“那个美丽大方的女仆小姐，能不能高抬一下贵手，我只是对你抱有欣赏的眼光，还不至于往我心口插刀吧？！”银发女仆如是说：“对于不用上半身思考问题的生物，这是对我人身安全的基本保障。”50月票或5000火患痈一章，已有一本书百万完结。,退休刺客的女仆人生,魔幻,连载中,2021年1月15日,1624756
7.9,28017,336.5,二一六年，全球首款意识潜入式游戏《九州》上线了，作为内测玩家的苏墨上线后却发现自己没法退出游戏了。玩家A：这人是主角吧？这经历他喵的也太魔幻了。玩家c：好漂亮啊！妈妈，我恋爱了！我这就去准备彩礼~玩家B：啊~我好像又行了！扶我起来，奶我一口我还能战斗！苏墨看着手中的狗策划养成宝典，喃喃道：wdnmd，这群人一直盯着我干嘛？不用去刷怪的吗？加更规则：100票或1w打赏加一更。炎帝20更！,大家都以为我这个npc是主角,游戏,连载中,2021年1月15日,956081
8.9,17304,329.9,这是个主角穿越变妹，升级打怪修成剑仙，最后嫁人的故事。轻松欢乐向，纯糖无虐。本书偏日常向，比较慢热的说书友群号：850594863 欢迎泥萌的到来(｀??ω????),剑仙的我才不需要抱别人大腿,古风,已完结,2020年3月7日,1087549
9.2,24216,328.7,苻子卿是一只幽灵，大概也算是一只快乐的幽灵。   因为幽灵姑且算是一种很好养活的生物？   不用学习工作，因为幽灵不需吃饭睡觉，　不用房子车子，因为幽灵可以穿墙飘浮...   不过，被束缚在一个地方的她，仍然会偶尔感觉到无聊，总觉得还差点什么。   直到某一天，她遇到一位前来驱灵的灵探。  一个诡物与恶灵四伏的世界里，一只不那么冷的幽灵的故事。van耍群：1138190285,这只恶灵不太冷,校园,连载中,2021年1月4日,501216
9.4,19517,322.3,在最新的虚拟实境游戏《米洛斯Online》的玩家之间一直有一些传言。据可靠消息说，王城里那间银龙酒馆的老板，是这个游戏的所有NPC里智力最高的一个。还有人说那个老板的真身其实是一条银龙。甚至还产生了那个NPC其实是一个死去的玩家的都市传说......但是看到了所有传言的银龙酒馆老板奥尔菲知道，除了第一条以外，剩下两个全都是真的。,论如何当一个合格的酒馆NPC,魔幻,连载中,2020年12月28日,1154640
9.7,18798,320.2,一对一纯爱仙侠变嫁      ,绝世仙姬养成录,古风,连载中,2020年9月4日,712603
9.5,22467,293.9,――从未来回到过去，原以为只是为了改变自己的人生，后来我才明白，我的使命就是和你在一起，我爱你，我爱‘我’。「银娘の书房：460215067」――新书《女儿心》已发出，日常传统都市变文。,爱上过去的我,校园,已完结,2018年7月31日,2003542
9.1,21851,291.7,有什么比变成少女还离谱的？苏明悦很纳闷，自从变成少女后，基友看自己的眼光开始不对了。这大概是一个女主被男主攻略成人妻的故事。......第二本书，想来应该比第一本好些，作者有始有终，绝不太监，群号：1124048982,才不要被攻略,校园,连载中,2021年1月15日,474433
7.5,21567,286.2,(本书自嫁，一百月票加一更，尽量月内还完)唢呐声声响，初听不知曲中意，再听已是棺中人。我死了但我突然又活了！上一次我没能实现梦想，这一次老子一定要娶五房太太，让我体验一下五天社保两天休的神仙日子！系统:都已经鸡飞蛋打，害搁这儿做梦呢？舞跳了吗？歌儿唱了吗？要是任务失败，双目失焦明白吗？我看你真没见过黑涩会嗷。给??爬！大姐..明天咱一定会有千万活跃粉丝，还请您再通融通融，放俺一马！,被抬棺之后我成了千金大小姐,校园,连载中,2021年1月15日,648670
9,19549,282.3,多年谋划，一昔破灭，然后在阴差阳错之下意外得知自己竟然只是所谓的……最终BOSS？看了看自己，又看了看对面的‘主角’，夏银默默的拔出了刀。“来，乖乖躺好。”PS：本书又名《每天都在相爱相杀》《我不可能被人化敌为妻》《最终反派当老婆你喜欢吗？》（奇奇怪怪读者群：594100992，欢迎来玩。）,最终反派不懂感情,玄幻,连载中,2021年1月15日,602381
8.9,15581,280.5,折织：“士道，你开后宫雨我无瓜。”士道：“G？”折织：“但你要是把手伸向不该伸的地方……”“啪！”折织：“这根黄瓜就是你的下场！”士道：“咦咦咦咦？！！”本书变百嫁人，嗯，嫁折纸。群号:701590763希望可以有人来和我讨论一下剧情。本书绝不弃坑，这你们放心，咱会用小铲子一点一点把你们全埋进去！另外《来到了战国时代但我为什么是二呆》，《末世中麻陶酱也在努力生存》请多关注。,听说我叫鸢一折织,魔幻,连载中,2021年1月3日,173965
8.8,16295,276.6,“龙娘的构成，是书与工业，剑与金币，铁与硝烟，花与梦”……这是一本以“在剑与魔法的世界使用科学”为主题的小说。……本书的主基调并非虐文，但第四卷末至第五卷会虐，不过女主不会失身，精神洁癖者慎入。………长评区被anti爆破已成常态。群：1012599363,风车与龙尾巴,魔幻,连载中,2020年8月15日,1103716
9,13082,274,穿越到火影的世界，并成为了志村团藏的孙女志村幽？这可怎么玩儿？・志村幽：呵呵，鸣人，你是我的了。・穿越者志村幽拳打日向雏田，脚踢春野樱，揍遍火影所有漩涡鸣人后宫，成功上位。・志村幽：日向雏田，爱是一道光，绿到你发慌。漩涡鸣人：霸道幽总爱上我。日向雏田：当然是选择原谅鸣人啦。*本书又名 《漩涡皮人》。 鸣人被女主调教的与原著完全脱离。本书毁原著，会调侃，嘲讽各个角色。,火影之绿耀,魔幻,连载中,2019年12月31日,3911831
8.8,21854,272.8,上辈子的立夏就是个略带文骚的小青年。重生成女孩儿的这辈子，依然喜欢摘抄那些有些意味不明的小句子比如“何为孤寂？”“清风，艳日，无笑意”“可否具体？”“左拥，右抱，无情欲”“可否再具体？”“不得你。”嘛。偏生就是这样一些似懂非懂的玩意，在这个文化贫瘠的时代里，掀起了一阵阵，连她自己都没有预料到的，惊涛骇浪。,只会抄袭还真就对不起了,校园,连载中,2021年1月15日,4219575
8.8,13480,264.7,（欢迎加入催更群，企鹅号607314655）逐渐接受成为女生现实的秦沐发现她的系统却越发得坏掉了“为什么现在任务奖励全是粉色系情qu道具了？？？”“你难道不应该叫最强人妻养成系统才更契合嘛！”“什么？攻略对象不止一个？？！！！”一个在末世逐渐长成合格人妻的故事（大雾（ps：其实应该是很正统的末日冒险故事）（再ps：其实攻略的对象只会有一个【超小声】）,末世圣母的白莲花手则,科幻,连载中,2020年12月2日,901188
8.9,15943,262.9,御坂美琴：“宇智波鼬，就算我给你生了孩子，我也不要当宇智波美琴。”穿越到火影世界，还改变了性别，御坂美琴最大的苦恼就是遇到了前世她比较喜欢的角色宇智波鼬。因为她和她的婆婆同名啊！,御坂美琴不要当宇智波美琴,魔幻,已完结,2020年12月12日,1666852
9.5,15881,260.6,“爱情的本质其实是苯基乙胺、去甲肾上腺素以及多巴胺三种激素对人体共同作用而产生的一种生理现象。”这是一觉醒来发现自己变成女孩的林易瑶某一天在老师的书里意外看到的东西。“宋玉，你知道接吻是什么感觉吗？”“大概...很甜吧。”“那......我们来试试吧。”――――变嫁日常番微甜，记得给五星好评呦，诶嘿～QQ793559027群文件都是宝贝呦，欢迎来取,瑶的恋爱物语,都市,已完结,2020年6月1日,684147
9.4,18386,259.1,成为反派boss之后的和美才发现，那个一直被视为“和平的象征”的NO.1英雄，好像，和自己的男友，有点像？？！   （ps：一个少女努力种田变强的故事。）（书友群948470293 欢迎加入催更）,身为反派的我居然有位英雄男友,都市,连载中,2021年1月13日,554188
9.1,18040,256.9,他，不幸性转到自己订制的**机械少女女仆身上，又穿越到危机重重的异世界。施法是不可能施法的，打架又不会打。就是驯服金毛来战斗才能维持得了生活的样子。★本文嫁人，嫁金毛,变身机械少女在异界的奇妙冒险,魔幻,已完结,2020年6月17日,2236822
8.8,17685,253.3,以葵花真解两年之后的剧情展开，延续相同的背景与设定，并在此基础上进行扩展。因疾病而被迫做了手术的男主，某天在医院躺着时，忽然有一本书，放在了他的床头上……,修炼葵花的我还要成为偶像,都市,连载中,2021年1月15日,1345222
9.3,19952,251.7,尾巴挥来又忽去，老板从没有人性，小狐狸背着快递，可爱却不是萝莉不用麻烦！不用麻烦了！不用麻烦了！你们一起上，我在赶时间，每天送快递观众都累了，主角也累了！副歌不长你们有几个，一起送好了，金钱呼唤我，养家需要我，狐仙很忙的~~~基本就是一个性转成狐仙的少年，由于送快递引发一系列故事,讲真，做狐仙很忙的！,玄幻,已完结,2018年2月15日,1058762
8.5,23701,248.3,林羽：“意外变成女孩子，想要瞒过弟弟，维持自己之前做哥哥的威严，怎么做？”沙雕书友：“给他点颜色康康～”林羽看着若有所思，某夜拍晕快要失控的弟弟～林羽：“伪装成男孩子，进入男生宿舍，怎么隐藏性别？”沙雕书友：“没救了，等着被透吧！”林羽怒道：“我被透之时，没有一个书友是无辜的，诅咒你们都变成女孩子被透。”书友：“还有这种好事，加我一个～”林羽：淦,修炼意外让我变得可爱,都市,连载中,2021年1月14日,722138
9.2,24813,242.8,“人家确实是他的新女朋友，请多多指教喔！”【租赁时间结束咱们就各奔东西，互不相欠】“不是装出来的哦，这个就是我的本音，真的很……可爱吗？”【别猜了这就是我专门为你们这群萝莉控练出来的伪音】“那部动漫吗？很喜欢哦！男主是一个相当温柔的人呢……”【不管是后宫还是纯爱，给钱我的兴趣就是整个scp基金会】这是一本讲述大叔重生成了美少女为了赚钱，不断学习成长的故事……,我重生成了他们的理想女友,都市,连载中,2021年1月15日,629553
9.2,19151,241.4,钢铁直男穿越成言情小说里的恶毒女二号面对主角光环加持的男女主该怎么做？当然是用学习打败剧情，认真读书，努力考上理想的大学，实现自己的梦想更重要啊男女主爱干嘛干嘛，哪凉快呆哪儿去，爷不陪你们玩了......轻松日常向甜文每天一更，更新时间一般在晚上每1000收藏或100月票加一更,变身成言情小说里的反面女二号,都市,连载中,2021年1月14日,323342
