评分,收藏,读过,简介,书名,题材,连载状态,最后更新日期,字数
9.1,1190,61199,做为一名宇宙无敌超级萌萌哒，集美貌智慧于一身，圆脸长腿花季妙龄，轻小说史上最美女主角。    为什么？我会拥有类似黄油存档读档的能力啊！！！(メ｀[]??)/   SAVE or LOAD！！！逆转吧！（空白卷，已经弃坑勿读）黑历史……,这个世界并不存在神明,魔幻,连载中,2020年3月27日,402714
10,474,61017,墨菲，男，一名35岁的中年大叔，自己也不知道为什么，明明是个中国人却要跑到日本来生活，在家当自由职业者，收入姑且算是稳定，然而就在平凡的一天平凡的时间，有一名少女找上门来，问道：我能当你的女儿吗？,在日本白捡到一个少女,都市,已完结,2020年12月24日,59878
10,339,60999,重新想了一下还是写下去好了。那个完结你们就当不存在好了还有一件事1～11作废了。,最强魔王被拐走拉,同人,已完结,2020年10月18日,12046
10,516,60980,樱花树下是一道绝色的佳人，月下二人开始了属于他们的狂想曲，蔷薇有属于她自己的芳香。,舰长大人的幸福婚姻生活,同人,连载中,2020年3月1日,15310
8.7,591,60927,到底是身体适应灵魂？还是灵魂适应身体？我，不知道，也不想知道。可是，现实却逼着我做出选择。因为，平凡的我不知为何，在突然之间变成了少女。变成少女以后我发现我所期待的日常慢慢的离我而去,如果我变成美少女后会发生什么,校园,连载中,2019年11月27日,217678
10,559,60653,本书被拒，已死。,胜者西装革履败者凤冠霞衣,都市,连载中,2019年10月11日,178174
9.3,826,60316,药娘就该被歧视吗？ 就不能拥有爱情吗？  这是讲述一个想做女孩子的男孩子的故事。也是一个药娘的故事。 ,药娘的爱情,都市,连载中,2017年7月12日,90311
8.5,541,60034,这就是一个穿越变成绿皮鸡公主的故事。ps：情节发展很快，结局大概仓促。还有，本文其实小清新（反正都被某点屏蔽了，这个也搬过来吧）,哥布林公主进化论,魔幻,已完结,2019年8月10日,442978
10,1132,59829,重生后来到现代修仙界的慕少城，本来打算拿到金手指，然后开启装逼打脸收后m之路，可谁知──“为什么爷我是个女的？怎么弟弟也没了！”系统:“额……呵呵，天机不可泄露！对！”这还不虿遥明明自己工作还好好的，怎么突然被逼迫当了个总裁的女仆，等等！这该不会是总裁文吧？！“夫人，已是丑r了，不如我们……”“你想干嘛！我们不熟，你…你e过来！”不但被一个男人缠上，而且总感觉系统更像是人妻养成系统。,变身的我居然是仙帝的前世小娇妻,都市,连载中,2020年2月23日,38806
6,604,59485,"这是一次不一样的斗罗大陆因一次小小的意外，穿越到了斗罗大陆。我:“咱要开后宫。”唐三:“我的小老婆在想什么呢?”小舞:“小熙，不要胡思乱想啦。”我:“你们都欺负咱:(,,?? ?? ,,):”群号937270759 密码是唐熙柔作者我会每次更新尽量字数在1000左右",重生斗罗的我爱上三哥,魔幻,连载中,2020年11月20日,27546
6,687,59174,『这本书很烂，别喷设定，作者很无知。』  『不定期更新，若是喜欢，可以小手点点红心。』,双重身的我才不会走上白给路,都市,连载中,2020年8月5日,47621
9.7,840,59117,光杆司令魔王酱的革命物语,魔王的高塔,魔幻,连载中,2020年4月20日,125389
10,754,59078,哪天我们宿舍谁变成女的，千万别忘了让兄弟爽一下啊”本来男（女）主在宿舍开了个玩笑，谁知，第二天醒来自己却变成了个拥有绝世容颜的少女，好在自己本来长得就很阴柔，对，是阴柔，为了保住自己的贞洁，她开始了装男生的苦逼生活“兄弟，别，我真的不是女生。”,兄弟我真的不是女生,校园,连载中,2020年10月1日,62984
7,1002,59062,前世奔波劳碌养家糊口的柳明h，007加班两个星期后猝死……重生到新世界后，看着镜中的美人憔悴的面容，她心中不断地吐槽：“老板，你们做个人吧？我现在也算个美女啊！洗白躺床上要不要？除了加班我什么都可以做！什么？别勾引你，不馋我身子，馋我剩余价值？哦，那没事了。” “当我再次猝死的那一天，你们这群资本家没有一个是无辜的！”本来以为这一世她会没有意外再次工作到肾衰竭死亡，却接触到现实下的诡谲……,变身之后的我为什么还是社畜,都市,连载中,2020年12月25日,82152
10,1189,58968,高考完，恢复新生了，谁告诉我这是什么情况啊我怎么成为废宅女大学生了我不想啊作者：不你想慢热型日常文空无一人的群号《772387775,我不想成为废宅女大学生啊,校园,连载中,2021年1月14日,120226
10,1208,58919,作为万千LSP们眼中的女神，刻晴觉得要维持自己玉衡星的高冷形象，然而此时某个蓝发后宫男猪出现了……“刻晴酱，能，能不能和我进行一次约会，就一次，一次就行！”“呵呵。”刻晴掏出某个东西，几剑挥出，然后指着空中剁的稀碎的牛杂，“再来，就是这个下场。”蓝发少年泪流满面，心里却道“终于又见到了，屁斜剑法，是屁斜剑法！值了，值了！”（总之，这是一个少年变身刻晴穿越到约战的故事，小白文，不喜轻点喷）,身为女神的刻晴表示不想约会,魔幻,连载中,2021年1月15日,69841
6,702,58862,穿越混沌，成为了大道中第一缕法则之气，也同样成为了混沌中的第一个生灵。     但问题来了，自己变成了一个永远只有六岁的小萝莉，冥灵表示抗议。     这是一个两个穿越者相爱的故事。,洪荒之我是大道亲闺女,玄幻,连载中,2020年4月4日,11124
7.8,693,58793,赛穆德：老婆……我想要孩子。安娜：……嗯，可是……赛穆德：可是什么？安娜：我也想要……孩子。赛穆德：那就……！安娜：可是，我是男孩子啊。作者：但你现在是个女孩子啊！（前后期女主情感起伏很大，毒坑慎入）,TS转生最后却成了母亲,魔幻,连载中,2019年8月15日,85883
6,808,58707,在情人节这天，没有女朋友的苏檀和好基友一起去爬山，结果双双坠下山崖。穿越到修仙世界，才发现自己居然变成了女孩子。然而提前她三年来到这个世界的好基友王陌莫名其妙就成了她的联姻对象！？这谁顶得住啊喂！沙雕-慢热-日常文，不喜勿入，封侵删！作者萌新，哪里写的不好的地方各位可以在评论区提出来，我会进行删改，谢谢！,成为朋友的未婚妻是什么体验,玄幻,连载中,2020年9月5日,62813
10,878,58674,沈吉一个跳楼青年，在意外中居然来到了一个和之前世界十分相像的世界。不过这个世界有着各种各样的元素异能，但是也没事每个人都能成为异能者，这个世界上有着各种各样的人，还有着妖和半妖。但是就是缺少了英雄，变成寒冰少女的沈吉被取名为为沈洛莎，遇到了改变了她一生的一群伙伴们。沈洛莎与这些伙伴一起成立了全世界第一个英雄组织......,变成寒冰少女的英雄生活,科幻,已完结,2020年9月28日,112706
10,625,58383,在明日方舟的世界里，一只名为北极狐的小狐狸奋力挣扎的故事，她会在这个诺大的世界里干些什么呢……,明日方舟之北极狐的旅途,古风,连载中,2020年11月29日,39604
10,591,58340,刘赢被关在了密室，谁能来救救他。,走不出的牢笼,都市,连载中,2020年6月11日,170550
6,398,58098,我是一只鸽子，拥有一把曾经杀过自己的杀鸽刀。,斗罗之万年之约,同人,连载中,2020年11月1日,14587
6,913,58013,这是来自另一个世界的历史。蒸汽机轰隆作响，透镜汇聚光芒，人类开始支配世界存封的力量。然而，在地球这个古老的世界里，并非只有人类这一初来乍到的种族拥有智慧。克兰奥斯本，一位来自维多利亚的博物学家，触及了这个世界最核心的秘密――他变成了奇美拉。而奇美拉只有雌性。奥斯本小姐很快就发现，世界上所有生物，都觊觎她那海纳百川的身躯。开启你最伟大的探索吧，从平凡人类，到万兽之母,奇美拉复仇之夜,魔幻,连载中,2020年12月23日,242638
9.3,1008,57249,“其实最开始变成狐妖，我是拒绝的！”“因为修炼不到火候，很可能因为长得太肥被人吃掉！”“即便修炼到火候，长得太漂亮，也可能被人吃掉！”“甚至曾经有人专门拟定过《狐妖的108种烹饪方法》”“你说有人权吗！你说这世道还有公道可言吗！”“什么？你问为什么修炼到火候也会被人吃掉？”“你呀...还需要时间的磨砺！”某不愿透露姓名的狐妖颇为头痛的回答道。,论狐妖的108种吃法,古风,连载中,2019年3月11日,94896
10,495,56791,月黑风高夜，月府经历一场屠杀，只留下月紫钥一人存活　   作为家族仅存的男娃，他背负血海深仇的同时，也有责任为月家延续香火　   可就在一次复仇中，月紫钥倒在血泊之中，辛得十年前收下的徒儿在其身负重伤时将之救下　   可醒来后，月紫钥发现自己慢慢成了女人，月家…香火已断！让她变得无比癫狂　   辛得作为徒弟的段无殇，给了她勇气，有了让她继续活下去的理由ps：本书双女主，前期男主无敌,魔尊徒儿恋上我,玄幻,连载中,2020年1月30日,43251
10,853,56779,苏文：你知道吗，蚯蚓切断后可以变成两条诶。苏可：是吗，所以呢。苏文：我是说，你觉得它们可能会和自己繁衍下一代吗？苏可：我怎么知道，你要是闲着没事的话就…苏文：唉算了，我直说了，我们结婚吧。苏可：啊？网图，侵权删有什么不对的地方欢迎读者朋友们点出来哦。,关于我是新郎也是新娘这件事,校园,连载中,2021年1月1日,69035
9.6,982,56719,在哪里存在，就在哪里盛开当我从岑铭成为岑青画从一个平凡的男孩儿变成一个不平凡的女孩儿生活的轨迹从此转了个大弯我眼里新朋旧友的分分合合很多精彩，也有很多遗憾龟速佛系更新了解一下～,不远,都市,连载中,2019年4月9日,181404
9.3,728,56266,缺心眼的神明哟，你把别人的人生当成了什么？可以攻略的galgame吗？,乱七八糟的攻略游戏,校园,连载中,2020年4月19日,78897
9.2,1040,56127,"回想起刚刚来到这个世界的时候emmmmm这是什么地方？这是我第一个疑问。emmmmm为什么我穿着裙子？这是我第二个疑问。emmmmm为什么胸前两坨感觉有点重？这是我第三个疑问。emmmmm为什么我头发是白色而且还这么长？这是我第四个疑问。总而言之，我越来越搞不清楚状况了。而且身体有些难受，感觉生了一场大病一样。这种感觉非常非常不好，而且我得从这个明显是初始之间的新手房离开。",如何通过穿越反抗那些高等生命,魔幻,已完结,2018年7月12日,156403
7.8,621,55392,穿越之后，我本以为能够混吃混喝，大开后宫，直到我变成了她……,这不是我想要的冒险,魔幻,连载中,2020年4月7日,358037
9.4,700,55278,在索亚世界，治疗牧师拥有逆天的瞬间治愈复活技能，强大的治疗魔法回路占据着整个魔法记忆空间，这也导致她们无法习得治疗魔法之外的技能。索亚世界的载体--索亚之星，茫茫宇宙中的一颗小型行星，她有着古老的传说，她，或许有意识人物简介在目录最后面剧情发展可能会比较快小白作者 更新随缘,被囚禁的牧师,魔幻,连载中,2017年11月25日,57849
10,745,54963,转世投胎到了古代，才发现，这好像有点不太对，这么性别错了？寄居这亡魂的骨伞，一刀劈碑断石的武者，江湖上的传说。这是一个穿越者成为武林大佬，最后……嫁给某个人的故事。会甜哦！很甜的。弥补一些遗憾。,叶家三小姐怎么可能是女孩子,古风,已完结,2020年1月23日,30719
9,961,54866,我叫岑青青原名岑青，蓝星穿越西游小青蛇人士，一千年前认识了花果山的一个猴子嗯，就是你们想的那个，然后我又被鸿钧送回了蓝星宇宙，回去也就算了可是为什么还是当初修练有成后化形的少女形象？  这让我怎么回家！而且我回来后居然灵气复苏了，然后猴子居然转世过来了。  这挺好但是..为什么要猴子又去闹天宫啊！还是在灵气复苏的局部末世..,帮猴子在蓝星准备闹天宫,都市,连载中,2021年1月4日,429092
9.7,987,54621,本应该无敌的黑化魔王在表面征服世界，实际报仇的目的下，一路高歌猛进，当大仇得报，准备假死脱身，操作不慎，真死在了大陆唯一教派安露丝教圣女艾莉斯手上。淦！算了，咱这一辈子不亏！谁知自己重生了，还重生成了艾莉斯。世界线还变动了，教会在魔王完全没有还手之力？什么？自己为了和平得嫁给魔王？！也就是…嫁给自己？！开什么玩笑，我可是直男！（穿上白丝）,我的魔王与圣女生涯,魔幻,连载中,2020年9月29日,70672
10,829,54489,倒霉，这是丁林唯一的想法。      不幸转生成最低级的魔物，该如何生存？      论一只魔界最底层的魔物怎么活。      系统君：莫方，有我。      丁林：滚，你最坑！,作为低等魔物被系统坑的日子,魔幻,连载中,2020年11月17日,126879
9.4,668,54412,重生成为妹妹，哥哥还是个勇者。你问我该怎么办？当然是攻略哥哥啦！嘛，建了个群：539827756,勇者的妹妹,魔幻,连载中,2018年10月7日,26373
9.2,567,54412,一个本应战死却化为精灵的少女，一个可以封印精灵的少年。当两人邂逅时，会交织出怎样的物语呢......,先行者在约会,魔幻,连载中,2017年1月4日,22926
10,766,54317,剑道天赋天下第一的华山派小师姑下山啦。群号959584670，希望能有人来讨论剧情发展（群内有里番，目前是六个，断更的话就是在写里番）目前已经确定骨科。女主十六岁，结婚会在十七岁之前，婚后还会有孩子。,剑道少女想要叛出师门,古风,连载中,2020年10月13日,180472
8,1243,54267,额，性转，认真写(??；ω；｀)不会模棱两可 是嫁人，嫁人。我不懂怎么贴标签。封面是网上的，很像两个主角就搬来了哎？真的变成女孩子了我可不是对着自己身体**的类型但能近距离接触其他可爱的女孩子真是太好了呢当然能遇到喜欢的人，我也会像个真正的女孩子日常为主,我一定好好做女孩子,悬疑,已完结,2020年6月18日,186832
9.3,1046,54257,问:作为精灵跟个普通人似的，还打不过AST怎么办？安亿：说到这个，我可就不困了，来，我操作给你看！安亿 被 AST 击杀AST正在大杀特杀！AST已经超神了！安亿:咳咳，打不过没关系，我也打不过，就是会死那么亿遍而已，小问题啦问：才不是小问题吧！――主角后面会变强能力来源于传说之下(是个知名游戏)(也许也不是那么知名)(没玩过也不影响阅读)群号:701590763,充满了决心的约战,校园,连载中,2020年8月29日,61085
6,756,54067,洛晴铃：听说过从徒儿开始调教的夫君吗？来过来，让本仙子教你。楚君仙：师傅不要，人家不要。洛晴铃：过来，今日你必须和我成亲。洛清道：女儿，是不是太唐突了？洛晴铃暗道：唐突个屁，老娘这叫提前抱起大腿，懂吗？群号：1021061038,仙子的夫君养成记,玄幻,连载中,2020年12月24日,158357
6,673,54014,楚语汐穿越了，而且还变成了一个平民家的小女孩，且看她是如何靠着一门厨艺，让自己一步步变的强大起来的吧！武侠转仙侠。,变身之这个厨娘不好惹,玄幻,连载中,2020年10月10日,274392
6,439,53899,小学生文笔，新人求支持,转生温蒂在约战,同人,连载中,2020年12月31日,15188
9.3,654,53858,重生回到两年前，距离那次危机还有一个月，看少女怎么在末世中逆境重生！（封面网图，侵删）,变身成美少女在末世,都市,连载中,2021年1月7日,33959
9.3,470,53633,男主:小小迷妹还想让我放弃，没得可能。学姐也不行。我今就把话撂这里了，我只要她，诶嘛真香。史上最羞涩却又很霸道男主的后宫之旅。作者企鹅号2221571377各位有什么问题可以来扣我，记得备注哦。,越过众女拥抱你,校园,连载中,2020年9月2日,216754
5.5,825,53587,从小受到酗酒父亲的冷漠对待家庭暴力围绕在我的周围至此..我变成了一个无感情的机器终于父亲还是因为酗酒赌博输得倾家荡产而丢下我和一堆债务跑路了我被那些放高利贷的人一刀捅死一转眼..我来到了另一个世界但是天不尽人意我依旧有一个冷血无情的父亲直到那一天遇到了两个人她们将我从这黑暗的世界里拽了出来（变身嫁人，鬼灭之刃香奈乎视角）（嫁给炭治郎）作者QQ：2268729671,无感情的我变成香奈乎重生在鬼灭,魔幻,连载中,2020年5月12日,18770
9.6,867,53550,几发子弹，葬送了一名锡安警官的生命，不过同时也给他的灵魂带来了另外的生活。带着上辈子残缺不全的记忆，安托利亚将在欧罗巴大陆的罗马帝国创立前所未有的功绩…什么？老乡你说啥？这里不是欧罗巴，也没有罗马？没事没事，领会精神。（变嫁，男主可能比较晚上线）书友群号：994861389，群名：九十五条论纲跳票了！,俺寻思这里应该不是罗马,魔幻,连载中,2020年10月10日,78696
7.9,910,53505,穿越到平安东瀛，发现自己有阴阳师天赋，参加阴阳寮选拔可是在选拔前，被七个面具附身，成了女妖？坑我！狐面：没事，你可以藏好妖气参加大飞出：你疯了！被阴阳师抓到咋办“你们几个都闭嘴！”“秦川灵姑娘，你自言自语什么呢？”阴阳寮看门的问我“对不起！我是来参加选拔的。”“若衫清弦大人，您怎么又在看门？”“看门的有事，我顶替一下。”他戴上大阴阳师的帽子，离开了大门群：771576486,心生七面之鬼,魔幻,连载中,2020年10月30日,94976
7,339,53469,约会大作战同人，更新随缘。只是自己脑子一热写的，文笔很烂，请不要喷我（如果你能看到这个小说），谢谢。（虽然会很慢很慢，但是不会太监）,天罚的约会,都市,连载中,2021年1月6日,152754
8.7,708,53302,“外表孱弱的普通高中生天音有着不为人知的身份――女装癖，但是某天天音的宝贝女装突然消失，取而代之的则是一名躺在天音床上的不知名美少女！？“我问你，你就是我的master么？”“不是，还有把衣服给我脱下来，现在，立刻”“诶诶诶！？”――二人的日常喜剧，就此拉开序幕！,我的女装竟然娘化了！？,校园,连载中,2016年11月3日,26778
6,727,53298,不定期更新,创世神之女综漫之旅,魔幻,连载中,2021年1月15日,36289
8.3,616,53256,告诉你们，老娘我可是敢和后宫王抢女人的女人！哈哈哈谁都无法改变我的意志的，啊哈哈“真夜，吃饭了！”“不吃！”“…………”“真香！最喜欢士道了！”“……………”不太监，初女作，因为实在没书荒了，只好自己写一个，在剧情跟着原著走，但在细节上还是尽量不在原著上。。。搞事就对了,约战里的饕餮,魔幻,连载中,2018年9月19日,54673
8.8,647,53219,本书基本上重置了，想写一个特别的故事。另外写小说并不是热爱小说，而是对小说有兴趣所以才写小说。群：600807908群不是我的，是我一个朋友的。请勿催更，谢谢合作！,身为狐妖的我渡劫失败后来到异界,魔幻,连载中,2020年12月15日,78354
9.5,912,52963,喜欢在平淡中建立起来的羁绊，喜欢在平淡中积累起来的默契，这大概就是我写这篇小说的初衷吧。,过去的我是个令人讨厌的家伙,校园,连载中,2020年4月1日,63755
6,624,52646,变成女生了？还变成了猫娘？啊，那就白给吧！「，第一次写，小学生文笔，有什么写的不好提提意见」,变成女生后的我居然白给了,校园,连载中,2020年12月27日,46966
9.3,670,52434,本书已完结,笼中的我,魔幻,已完结,2018年1月1日,77222
7,705,52309,末日里，一只少女捡到一只野生幼龙，将其养大最后被幼龙推倒的朴素，枯燥且乏味的甜蜜故事。某女:“你个败家玩意!我刚刚摆放好的家具就被你咬坏啦！讨打!干啥!你再凶我!胆儿越来越肥了啊？咋？又给我使眼色是不是!我今天（被某龙扑倒）……啊，别，停下，我错了，我不该凶你的，我不该给你使眼色的……那里不可以……嘤嘤嘤……”,末日少女生存进化,科幻,已完结,2019年10月28日,200118
9.3,647,52286,天大地大，劳资最大，遍历天下，誓死不嫁。,劳资就是这么刁有本事你娶我啊,魔幻,连载中,2020年4月1日,49792
9.3,784,52117,秋风轻抚，那是爱的味道，冬日喧嚣，又过了一季，李洁就如同秋风冬阳，起起伏伏。PS 本文为变身嫁人文，不喜勿入，群号433589184,变身之秋日恋曲,都市,连载中,2018年7月26日,113528
9.6,1147,52098,希望与现实交叉，花与梦交织，血与阴谋交错的故事。,神从不祈祷,魔幻,连载中,2018年6月10日,363471
10,172,51748,嫁人之后究竟还能不能百合（若有雷同，纯属巧合）皇帝：士道，从今天起，你就做我的太监总管吧！若有误，请见谅，谢谢！(作者短小无力),约战里的话痨皇帝真奇怪,同人,连载中,2020年4月26日,21232
9.7,655,51678,看见某人把带毒的汤喝下去后苏同学露出了胜利的微笑。“你药放多了，到时候可能受不了。”“啊？”然后苏同学被抱走了,成妇谋夫,玄幻,连载中,2020年3月25日,93819
6,1314,51649,一觉醒来，天地变换。他莫名其妙地重生在一把剑上，成了一只器灵，还偏偏被人认主了。从此，他就琢磨着怎么逃离这个主人，逃离这个世界，然而，更让他错愕的还在后面。。。,当器灵的那些年,玄幻,连载中,2020年12月20日,61854
9.5,510,51438,偶尔突发奇想想到许多故事，但过程太短，大多是些生活片段，索性写成短篇，聊以慰藉。,短片故事集,都市,连载中,2020年2月1日,239040
10,872,51153,本来以为死定了，结果发现自己变成了血族公主。       你们是谁，放开我。       而且现在还是一个病弱的萝莉。还有一个未婚夫，我去，未婚夫。我可还是个男人。       这个人真帅！       要想我嫁给你做梦。,吸血鬼公主不想嫁人,魔幻,连载中,2019年7月23日,139294
1,958,51003,他曾是太子的心腹，公主的恋人，本应前程似锦的他一夜之间家破人亡。四平山顶的奋力一跃后，他变成了她，一个一无所有的女人。她该如何在这乱世中生存下去？群号：215992862,身为谋士的我才不要入宫为妃,古风,连载中,2021年1月15日,90754
6,351,51003,普通高中生偶然穿越，为了活下去修炼成神，打遍世界无敌手，可是在一次偶然得到回地球的机会后，在修炼时惨遭暗算，醒来却变成了自己的外孙女！  学业繁忙 更新随缘qwq.,打遍世界的我却变成了女孩子,玄幻,连载中,2020年7月14日,29875
7,1074,50533,正常的世界之下隐藏着一个离奇古怪的里世界，谁能想到古老的水井藏着畸形的怪物，无尽的镜之回廊又封印着那个诡悚的鬼影......    G书拿着先辈的笔记下定决心走进这个令人颤栗的古怪世界的时候却遭到了鬼物的袭击倒在了前进的道路.....    当他再次醒来的时候，他默默的拍了拍裤裆，空空如也。   沉默片刻， G书抹了抹悲愤的泪水仰天长啸：“男儿当自强！”    侵立删    ,离奇古怪的里世界,悬疑,连载中,2019年5月14日,40898
6,725,50470,没有人缘的林宇，为了能让自己的人气超过朋友们，被梦中的大姐姐，变成了一个可爱的萝莉，这件事而且被兄弟知道了.....作者随便写的，可以给出意见哦。,变身后兄弟竟然看上我了,都市,连载中,2020年11月27日,71064
9,539,50401,由于神的智障操作，我转生了，没错，转生成了妹子，唯一带着的有用的金手指，是stand power 可这又能怎么办呢！鲁迅说的好啊，生活就像是被强x，如果不能反抗，那就学会去接受，嗯，我觉得男主长得很可爱，不如我们……嘿嘿嘿,死后带着替身能力去斗罗怎么办,玄幻,连载中,2020年2月26日,34835
10,645,50310,因为某场战斗，姐妹被打入了异世界，失去肉身的姐姐附着于妹妹身上，在那个世界中，她们遇到了……Ps1：本书嫁人，但是很慢Ps2:大概率有原创，不喜忽喷,双生少女的约会之旅,魔幻,连载中,2020年9月6日,93729
