评分,收藏,读过,简介,书名,题材,连载状态,最后更新日期,字数
6,113,8239,恢复灵气，拯救末法世界后，却意外变成女体，本准备颓废等死，谁知道在自己身边，情况开始怪异。       有些准备姐妹盖饭。       “亲爱的，你都拯救世界啦，我允许你和我妹妹一起玩哦！”       偶尔盛开百合花。       “我虽然是女孩子，而且我不喜欢男孩子，但是你可以变成女孩子啊！”      话说 自己好歹是真仙，德国骨科不至于吧？       “我们不是亲生！”,真仙无敌之后的颓废生活,玄幻,连载中,2021年1月15日,40478
10,219,8234,人类居住的大陆遭受道异族的入侵――他们自称为“魔族”。人类不敌只好与魔族签订和平契约。之后的两族和平共处。但他们知道，终有一天这个和平会被打破。“撒，拉尔！你可要好好的养妾身，不许去找别的小姐姐哦！不然～你是知道的～”（妩媚）“呃……那你倒是给我变回来啊，你一副萝莉的样子让我怎么下的去手啊！”PS:没养过老婆的都点进来看看，保证看了你们也想要养一个。　,魔王大人被勇者捡走了,魔幻,连载中,2020年7月14日,16637
6,204,8229,重生成妖，却被幻想神弄成了奇怪的的妖族。本体虽为妖刀，却还有另一个身份～式神录！记录世界最强式神。只要有足够的实力就可以变成里面记录的式神。所以说～我的天为什么式神录里面会记录崇宫危慷何彝婺兀炕褂形什么崩坏三的西林会被记录在里面？浮华上仙，法力无边～哎哎哎！上仙的本体不是赤鸢吗？为什么会有无线复活，掌控世间之火这种bug设定？她们真的是式神吗？,我是式神录,魔幻,连载中,2019年9月8日,32540
6,251,8216,"公主殿下被恶龙夺走了，然后被一位勇者救了回来。国王非常高兴，愿意把公主许配给他。询问公主的意见，公主欣然同意。在婚礼晚会上，公主贴在勇者的耳边轻轻地说道:“把你的尾巴藏好喽，我亲爱的恶龙~”（速热不虐，女主视角）【本文有一个发糖糖的梦想，希望读者们能把‘好甜’打在互动里】",把你的尾巴藏好喽我亲爱的恶龙,魔幻,连载中,2021年1月3日,8616
6,110,8195,女主角：重生、性转、萝莉、嫁人。男主角：重生、后宫、无敌,命运的双重奏,魔幻,连载中,2020年3月22日,24490
6,120,8194,“我要金手指，我要小萝莉，我要穿越到异世界，成为最靓的仔……”(中二少年箬小枫正躺在床上一遍遍地梦呓)系统：没问题哒――你要的都给你~今生：我，箬晓芸，三界之内无人能敌，万古芳名无人不知，不为生死所拘，不为生活所迫，自由自在的小龙娘――本应这样的 但是……晓L：妹妹，起床了，再晚就要不到饭了!晓芸：来了……ps：图片源于网络，侵权删,重生为龙娘的我仍在乞讨度日,古风,连载中,2020年6月20日,19336
6,142,8185,自嗨文，第一次写，纯属无聊，有什么设定不对请多多包含，实在不行量子力学，图片侵权必删,某旗舰的综漫旅途,游戏,连载中,2020年11月29日,10009
6,251,8155,“因为某个不靠谱的’异能师’学妹参与，所以我变成了类似魔王的存在。但谁知道魔王是女的呢，而且还这么好看在变回来之前，我还要被监视……所以这一切都怪唐云谏！”唐云谏：？？？我是男主怪我呗本书又名《就算变成魔王也不想谈恋爱》（封面来自网络，侵删致歉）,变成魔神亲的我光速白给,魔幻,连载中,2020年11月29日,12533
6,87,8141,史莱姆的日常校园生活……,史莱姆的我在校园,校园,已完结,2020年5月8日,5710
10,154,8138,2020年的nt高中生，若楠同学，正在用心地记录她奇妙变身生活的点点滴滴……基友：“啥比东西，你又在写你马呢，快上号，爸爸带你”若楠：“真的啵，我上你个锤子，给劳资爬”基友：“你又欠抬？看我今天不在床上吊死你个憨憨，非要逼我动腰！”说着掏出了武器。“怕你不成！谁怂谁是狗，撸你的6厘米！”－－－－－本书是兴趣使然的变嫁文1v1经典对线，祖安不虐纯爱天下第一！（本文有点流水帐）,不要和我谈学习的事,校园,连载中,2020年5月29日,26372
6,97,8126,宅男黄油画师在努力画着充满了自己爱的（性癖）女人，还把她从小到大，最后年老体衰的身材画了出来，在外加上自己的设定，结果看着这个纸片人哭出了声。要是我有这些设定怕找不到女朋友！简介我都不知道写啥勒结果就是胎穿+变性（ps：最近看jojo4、5看上瘾了，所以就想写写，可能ooc，我尽量保持主角的设定）不喜，左上角走你随缘更新,我学这些技能是为了女孩子啊,魔幻,连载中,2020年12月17日,23257
6,56,8126,脑子里有个主意，刀剑里的卡面来打如何，神极限家暴无敌。,加个书名号就是书名是什么事,同人,连载中,2020年4月8日,9519
6,150,8121,作为唯一一个在穿越途中死去的人类，我被一个神给救活了。可结果是。。。我变成了女孩子。变成女孩子就算了，但是我还成为了一只魔物，而且还是混杂着魅魔血脉的吸血鬼淦！（内含大量元素！崩坏，mc（mod），克苏鲁等！）,吸血子的奇妙冒险,魔幻,连载中,2020年8月8日,35774
6,186,8107,本人是一个学生党，第一次写书。请大家多多包涵。一个人到了海贼世界，会掀起怎样的波澜呢？,海贼之蛛后,同人,连载中,2020年11月15日,4349
6,138,8098,约战同人,为美好约会世界献上鲜花,魔幻,连载中,2020年10月3日,81711
6,73,8050,当从未来而来的穿越少女遇上了花心贵公子，两个本应该毫无关联的陌生人因为一次意外的邂逅而上演了一段她与他的千年恋爱物语。恋爱系，致郁系，魔幻系。（女主文）,穿越千年之前,魔幻,连载中,2020年5月8日,133329
10,127,8048,。。。。。。,鸥与鹭莫相猜,都市,已完结,2019年8月23日,18
6,69,8048,注:本书暂无简介，一切请以实物为准,律者手记,游戏,连载中,2020年2月1日,16417
6,133,8046,苏雨菲:“啊！你干什么？”莱昂:“你说我干什么？”苏雨菲:“不，不要过来。”莱昂:“你好香。”苏雨菲:“放手，我可是男的！”莱昂:“那都是上一世的事了，嘿嘿。”苏雨菲:“不，，不要！”,在异世界怎么会遇到青梅竹马,魔幻,连载中,2019年5月31日,43739
6,169,8039,本人的处女作品，希望大家不要喷嘤嘤嘤，有什么想法可以提出来哦,在约战的我不会被攻略,同人,已完结,2020年4月19日,1085
8.4,345,8021,让我冷静一下,女体的我是绝对的强者,都市,已完结,2018年5月4日,23310
6,101,8012,初来乍到，多多关照，不好看没关系，提提意见??谢谢了（每日一更）,斗罗之科技革命,同人,连载中,2021年1月16日,16186
6,88,8006,这是发生约战世界的一个故事“中国有句话说得好”少女抿了一口手中的红茶：“三十年河东三十年河西。让我们清算一下三十年前的旧账吧，崇宫危　崩醋宰髡叩挠亚樘嵝眩褐鹘遣恢挂桓觥Ｊ槿:935636323进群答案:？？？,我才是士道的正宫,同人,连载中,2020年8月25日,9522
6,240,7970,叶梓墨因一场车祸魂穿到玄武大陆的一名女孩身体里，两千年后突破至大陆至高境界，破开虚空回到地球，地球却只过去两年……,大陆第一的我要嫁人,都市,连载中,2019年6月21日,10418
9.3,203,7922,一瓶饮料改变了我的性别我忍……没事没事，女孩子也是很受欢迎的啦！可是为什么还有这么多事情等着我去做啊！你问我要不要肩负起这个重任？我的选择是……每周三周末十点或者更晚更新。(深夜党的胜利),你我的选择,校园,连载中,2018年11月4日,84745
6,108,7917,苏瑞尔：菲莉亚你看看那个魔王是不是很嚣张上去砍他。  菲莉亚：你怎么不去让我一个手无缚鸡之力的弱女子去你忍心吗。男主立马：那明天别想下床。然后漏出一个阴谋得逞的笑容。可怜的女主：嘤嘤嘤QAQ（以上是我想对老婆干的事。滑稽b.）,转生最强剑灵,魔幻,已完结,2020年9月27日,12189
8,89,7912,比日光还温暖，比糖果还甜蜜，比清澈的湖水还要让人心旷神怡。地狱罪之七魔姬。渡劫失败而来的九尾狐娘，天生桃花运不断的妖僧，来自不夜城的偶像歌手爱丽丝，弑兄的病娇伪娘米歇尔，被弟弟背刺的哥哥魔王希维尔，在地狱中的天使少女希雅路西法。被魔王救赎过的奴隶少女狼女仆瑞秋。以上几个主角的故事，形成一个学院，在地狱摸鱼的故事吧。（封面地狱同人图。没有版权，侵权删）,魔王的地狱天使学院,魔幻,连载中,2020年12月31日,112413
6,244,7885,到时候再想更新缓慢慎追,变为死灵术师的我被圣骑士攻略了,魔幻,连载中,2021年1月3日,18512
6,174,7885,天叶诚:“所有的罪孽，都由我来承受！”天叶羽:“哥哥，你别犯中二病了……”天叶诚:“……”,约战中的天叶羽,同人,连载中,2020年8月17日,8870
8.5,111,7872,约战同人文  嫁人（不喜勿入）  还有作者今年艺考明年高考，更新时间emmm  ,夜空下约会,玄幻,连载中,2019年9月19日,38931
6,74,7859,当我发现自己穿越到异世界，自己将要拍卖时，但是我自己并不想受这种生活所困，于是开始了逃脱之旅。故事从此开始。,异世界的我应该存活这个世界吗,古风,已完结,2020年6月6日,59731
9,106,7840,孤独的我，在一次车祸过后，原本以为我的人生会就此结束。但是万万没想到，我重生到了一个平行世界，还变成了一只合法萝莉。这个世界游戏科技发达，已经发明出了完全潜行技术，最后，就想某神域一样，玩过的玩家都出不来了。（图自网，文自批）（文笔渣渣）,变身lo娘的死亡游戏日常,游戏,连载中,2019年8月21日,13090
6,157,7806,“你愿意嫁给我吗？”“那愿不愿意陪我一起改变这个世界呢？”“嫁给我，什么事情都依你。”“如果有一天，我要直面这个世界最深最恶的黑暗，那时的你还会不会陪在我的身边？”“我会化作你的骑士，斩尽前路荆与棘。”“那就开始我们的革命吧，同志。”她因为高中聚会上发生的一场意外而转生成了名为薇尔莉娅的少女。在陌生的世界中，她遇见了愿意陪她一起胡闹的男孩。,叛逆圣女与她的骑士,魔幻,连载中,2020年7月8日,72073
9.8,259,7803,圣历878年秋，教廷失势多年，迈尔斯法师塔如日中天。在这个魔法师地位至高无上的年代，教廷却出了一个能够免疫魔法的魔剑姬。她一人、一马、一剑！在本泰兰大陆东奔西跑，仅为了一个遥远的理想。在一次任务的归途中，她遇到了自己前世冤家转生成的猎魔人。一个是硬汉变美少女的闷骚魔剑姬，一个是大小姐变小帅哥的吃货猎魔人。这对前世欢喜冤家将在本泰兰大陆上擦出怎样的火花呢？,涤罪剑姬免疫魔法有什么不对吗,魔幻,连载中,2018年2月1日,274
6,277,7801,男子高中生意外转生成一只蝙蝠?还是一只雌性蝙蝠?可是这样也不能阻止它活下去!前期异兽中期性转，整体西幻网游风格。,转生成蝙蝠又怎样,魔幻,连载中,2021年1月16日,32122
10,218,7799,对于年幼失去双亲，在孤儿院长大的我，猎杀魔物是我唯一感受自己还活着的方式。大部分人出门在外只是搜集资源，魔物的强大已经让人放弃了扩大板块的想法。地图上只有那么小小几个国度。我以恶魔的灵魂为食，终于有一天遭到反噬，虽然没死，但也不是从前的样子了……也许，我应该体验下不同的人生？（本书的世界观比较残酷，心理承受能力弱慎入）,不再孤独的旅人,魔幻,连载中,2020年6月2日,33986
10,178,7794,男主的发小（女主）经常被误认成妹子。一天，这位发小捡到了一个神灯，便向灯神许了三个愿望：变超级有钱、把男主变妹子然后捉弄、以及和男主永远不分开。结果冒牌灯神全搞砸了！钱就那么一点点，变成女生的人也变成了自己，最后是两个人一旦分开超过十米就会挂掉！于是俩人就永远在一起咯~,不谈恋爱就会死哟,都市,连载中,2019年12月22日,14723
5.5,53,7788,.............................................................,你不能召唤我,魔幻,已完结,2019年1月13日,36
6,139,7785,变成女生怎么办，当然是给朋友爽一爽，什么?朋友不在身边，那果聊什么的也不是不可以的ps:前几话主角戏份较少,变成女生的我不想恋爱,校园,连载中,2019年12月2日,5081
9,165,7755,已断更，误入。,可爱邪神大反派,魔幻,连载中,2019年3月20日,32622
6,55,7749,我叫王小宝，是一个身高175、体重200的胖子，同时也是个爱好二次元美少女的宅男，然而突然有一天在我醒来的时候，我的漂亮女仆手办竟然成精了……本书慢热（封面百度搜的侵删）,废宅的漂亮女仆女友,校园,连载中,2019年11月18日,4909
6,171,7749,“呐，阿阳，你后悔吗？”绝美银发少女看向一旁牵着自己手的青梅竹马兼好友的林阳耳边温柔的笑着问道。“我不后悔。”林阳说着，转身将少女拥在自己的怀里，在她耳边坚定不移的说道，“就算再来一次，我也还是会选择你。”　　“可我之前是男孩子啊，你现在能接受我吗？”怀里的银发少女小声的说道，但却抱的更紧了。“你现在是女孩子了，就算你之前不是，我也一样会喜欢你。”,属于我们的时代的恋爱不会平凡,校园,已完结,2020年11月2日,42847
7.8,54,7748,身为小魔仙，惩奸除恶是我的使命！呔，拿命来！,巴拉拉小魔仙之沙罗沙罗,魔幻,已完结,2019年6月3日,89
6,142,7682,（本书富含高糖与战斗元素哦！）他曾经是只比女生还要可爱N倍的银毛伪娘，但却拥有着一颗猛男之心因为一场车祸，他变成了她，而且当她睁开眼竟发现身旁居然睡有一个跟自己一样没有穿衣服的男生！（原本想要救自己的普通高中生）就这样，一只拥有着极其强烈的猛男之心的奶凶龙娘与差点成为自己救命恩人的男生展开了奇妙的异世界旅行,就算变成龙娘我也依旧是个猛男,魔幻,连载中,2020年9月8日,2058
10,79,7667,……,小乞丐的自我修养,都市,连载中,2020年2月9日,2140
6,90,7626,我重生了……但……托、托，可以，不要靠这么近吗？奥托:呵呵 你说呢？樱~莲！救我！卡莲:emmm……救不了，告辞！,重生为樱的我爱上了天命大主教,同人,已完结,2020年12月19日,10648
6,230,7607,嗨大家好我是一个高中生。但是我的生活为何如此魔幻？还要变成一个金发的小姐姐？不要啊兄弟萌别靠上来啊？,我能变成金发少女不是我的错,魔幻,连载中,2020年12月2日,35861
9.3,198,7566,,你是我最爱的宝藏,都市,已完结,2019年7月28日,0
9.1,367,7534,这只是一个普通的天朝高中生，到了广大穿越者前辈穿烂了的，剑与魔法的世界的故事，但是，为什么我是被开后宫的那个？还玩个鬼啊！【本小说与默示战纪录世界背景相同，有兴趣的的话大家可以去看看哟】,转性到剑与魔法的世界玩个鬼啊,校园,连载中,2017年12月20日,29123
6,193,7515,女主嫁士道，十香什么的靠边站,当士道的小精灵不香吗,同人,连载中,2021年1月11日,12876
10,163,7512,买个豆腐摊上穿越咱也认了，本来想好好的当个普通萝莉过日子。结果您告诉咱还是个重要人物，必须得参与主线？行吧那咱也只能带着唯一的随从跟着勇者大人去打怪了。本书又名《一级满装备的萝莉带着满级零装备的随从的开黑故事》,某落魄的吸血鬼领主小姐,魔幻,连载中,2019年8月12日,9360
6,190,7498,一次意外的穿越，令遥子获得了泽塔升华器，本以为可以从此走上装13的道路。       结果……       为什么会变成女孩子？！       为什么会变成奥特娘？！       为什么会来到约战世界？！       看着精灵和魔法师，怪兽和宇宙人，遥子发觉这个世界有些不对劲。       “遥子。”看着面前拿着一把大剑的蓝发少年，遥子搭上少年的手，意外的有些安心。,获得泽塔升华器的我来到约战,同人,连载中,2020年12月24日,22282
6,168,7497,死于妻子之手的张凌，醒来时已成了天苍宫的飞雪仙子。一时间各种麻烦都来了。大师兄的死缠烂打。渣男的无节操献媚。男主的英雄救美。还有敌对门派的少主要求和亲。。。。。。作为飞雪仙子，她的故事才刚刚开始。,飞雪仙子最近有点奇怪,玄幻,已完结,2020年7月21日,47588
6,243,7478,当一个满幸运的精灵出现时，会出现怎样的影响呢,幸运的约会,同人,连载中,2020年5月6日,1902
6,130,7474,江湖啊，太大太深！人心啊，难解难测！岁月啊，走的匆匆！情感啊，纷乱复杂！人生啊！酸甜苦辣！世事无常事事常，悲欢离合总无情。,坑娘嫁到,古风,连载中,2020年6月8日,87936
6,177,7450,莫千河：小熙，你跑不掉的哦～，乖乖做我的人吧！白熙儿：不要啊！！！～～～～～～～～～～～～～～～～～作者新建舍友群，欢迎大家进来探讨和深入交流，群号：1078099299,舍友还请不要这样对我,都市,连载中,2020年5月3日,18403
6,63,7427,丧尸？去死，我可是无敌的。告诉你老子强的一批作者是萌新，还是个学生不定期更新QQ群：519694634作者萌新，是个学生不定期更新,拥有scp能力的我无敌,魔幻,连载中,2020年6月6日,464
6,39,7426,本人第一次 多多包涵,斗_之天,玄幻,已完结,2020年3月3日,231
7,188,7413,穿越之后，为了遮掩自身的秘密，陈珂不管接什么任务都会失败。当陈珂换了主人，为了不被处罚，决定成功做一个任务的时候，却发现她已经不会做成功的任务了。“我下次一定任务一定会成功的！”“乖乖接受处罚吧。”“真香！”（简介看看就好，只是内容一部分）由于作者原因，该书自2020年春节起停更两年半，至2022年高考后恢复更新,任务又失败了,玄幻,连载中,2020年1月31日,31655
6,114,7399,这是一段救赎的故事。,背叛者必须死,科幻,连载中,2021年1月12日,121773
9,306,7397,为什么我不是人类啊(??_??)在异世界生活了n个年头的女主，和刚刚来到异世界没多久的同样灵魂的男主之间的故事（平行世界之间的同一人）ps:主角是女主ps:主角是反派ps:标题是以男主视角写的ps:本文嫁人百合党勿喷（有时间番外篇可去百合试试F(*∩_∩*)′）ps:好多ps啊ps:491282183神秘的企鹅群,在异界的我为什么不是人类,魔幻,连载中,2019年3月18日,108278
10,183,7364,为了把师傅从死宅的边缘挽救回来，我尝试着与师傅交换身体好让她体会一下我的整日含辛茹苦赚钱养家的辛苦以及这个社会的险恶。但……师傅你那阴谋得逞的表情？？？,师傅是个美少女,玄幻,连载中,2019年1月6日,11632
6,76,7331,......,被下药后我成为了妖姬,都市,连载中,2020年1月11日,252
10,120,7305,黑历史,上条先生你好,校园,连载中,2019年7月25日,28215
6,136,7290,她一骑当千，以一敌万。可惜不会骑马。她穿着华丽，样貌倾国倾城。可惜身高只有1米3。她身居高位，连国王也要看她脸色。可惜是个笨蛋。…………………………………………………………… 克烈・蒂芙尼年仅10岁就以一己之力击退虚空，击杀监视者……但这和我有什么关系？对于这个优秀到耀眼的前身，克烈压力很大。自己毛也不会，配得上“英雄”一词吗？,不靠谱的骑士小姐也想当英雄,魔幻,已完结,2020年2月9日,56869
6,178,7288,四大魔宗之一的血冥宗少主楚月阴，自打出道修仙界，把修仙界搅的鸡犬不宁。杀人夺宝、仗着高修为和秘术偷盗个大宗派功法、秘宝，还有偷窥天之骄女沐浴...终于在抢夺修真界第一宗门浩瀚宗至宝轮回镜的时候被各大派高手和力围剿穿越到一个蓝色星球上，这里不需要马就能启动的车，有像赤羽一样能飞在空中的大鸟，还有、还有自己身上为啥会有偷窥天之骄女一样样的东西啊，那两坨太晃眼了......,魔教少主的我才不会爱上男人,玄幻,连载中,2020年12月23日,78848
10,70,7254,本书已重置并加以修改，请点击作者头像传送门，进行观看,试求吾的生活如何重新归于平静,魔幻,连载中,2020年5月23日,626
10,72,7239,我就是一个普通的高中生罢了，为何我脑海里会有人在聊天，啥为何我灵魂是女性还是个萝莉，有毒吧，我可是个男的。男主：丫头你迟早会记起的，三千亿万亿年前的事。苏樱雪：世界也差10亿多年。,大帝的转生萌新生活,玄幻,连载中,2019年6月10日,25019
6,94,7229,燕知有一天向神请求：“我有一个网恋女友，马上就要见面了，可是她说她的家人不会同意我们在一起……”　神表示小问题。于是……燕知就变成了一个女人。　“我不是帮你解决问题吗，多简单的事，你想想看，只要你变成了女人，你对象的家人是不是就不会反对你们在一起？”神回道。,腹黑男的暴力女神成长记,游戏,连载中,2020年4月12日,74742
6,152,7228,"银河之光。（欧布的人间体是主角重生的沧月）（主角虽然重生沧月但是第一个世界不是偷星九月天，也不会一直呆在奥特曼世界）欧布奥特曼历史的长河。又一次轮回。手拿圣剑。书写传奇。巨大的圣剑，新的传奇主角:我只想问一下为什么我会变成沧月啊！这是一个女人间体的故事欢迎加入欧布奥特曼之我是沧月书友群，群聊号码：703426329",奥特曼之欧布传奇,科幻,连载中,2019年5月19日,8828
6,62,7223,第一次写，目前大致是前期甜后期虐 最后女主可能要死。    玩的太久前，不知道怎么写了，不定时更新,情毁,校园,已完结,2020年4月15日,29778
9.9,112,7223,莫h晔，死后灵魂一分为二，被送往异世界 。白虎少女与猎豹少年在洞穴中苏醒，面对曾经的自己，她（他）的生活会如何呢？和变成女孩子的自己的同居日常。,白虎X猎豹,魔幻,连载中,2020年8月13日,88912
9.9,281,7206,自从知道自己穿越到了《Overlord》之中，伊文蒂亚又决定了，加入安兹.乌尔.恭，报紧傲天的大腿，一起迎接游戏关服，去异世界搞大……咳咳摸鱼。群号：729948037（答案在神奇宝贝那本书里面）,绝望之理,魔幻,连载中,2018年6月29日,41635
10,102,7194,身为龙皇的萝莉被作者酱强行契约给勇者，然后强行（被作者）过上恩爱日常的故事。不会写虐尽量纯糖咱不会写简介就这样了,龙皇萝莉的纯爱物语,玄幻,连载中,2020年2月18日,30690
6,111,7163,这是一个沙雕带着系统在异界卖萌的故事别说我写的迷，不迷就有鬼了，萌新写的还想要多好（理直气壮）文笔较烂，而且作者会随着最近看的小说换写的风格（叉腰）这本书可能是重写最多的书了（嚣张）没有了，咱撤了,变身成史莱姆的异界之旅,游戏,连载中,2020年8月2日,19601
6,128,7155,本文为希尔薇的同人作，看男主威廉和希尔薇的爱情故事，看威廉如何一步步解开希尔薇的心结，打开希尔薇的心扉，最后步入爱情的殿堂,你好希尔薇小姐,都市,连载中,2021年1月15日,64376
6,110,7150,一朝穿越斗罗，又该何去何从？记忆中的你，又是真是假？即使忘却，又能否重新开始，回到从前…――所有的相遇都是久别的重逢……,穿越到斗罗的我要成为最强呀,玄幻,连载中,2020年11月2日,15005
10,154,7150,前世死宅的我，穿越成了魔族公主。看我如何在异世界混吃等死，不管是魔王妈妈，还是恶魔大军，在我这个顶级自由人面前都是不堪一击！“啊！妈妈，疼！别打我惹。”,魔王炼成手册,魔幻,已完结,2019年11月17日,8463
6,268,7134,维斯特??加登从来没有想过会发生这样的事。前世作为罪人死去的他，在死后却转世成为骑士家族的独女，甚至还能够与自己死前的养子再度重逢。心中对自己孩子充满愧疚的她本想以如今的姿态默默地守护着自己的孩子，却不想有一天，她所等来的并不是那孩子的结婚请柬，而是……“我喜欢你，歌蒂妮雅小姐。”“闭嘴，逆子！――”面对着眼前男人无比认真的告白，歌蒂妮雅红着脸，咬牙切齿地如此回道。“――叫我爸爸！”,叫我爸爸,魔幻,连载中,2021年1月6日,15830
